售后服务顾问广汽集团,汽车
管培生（荷兰）汉朔科技股份有限公司,IT软件
财务实习生飞未云科（深圳）技术有限公司,金融投资
机械操作室码头操作岗南通通海港口有限公司,物流运输
动力电池系统工程师（常熟）新新人力,汽车
法务实习生上海达美乐比萨有限公司,餐饮娱乐
雷达系统工程师深圳市安卫普科技有限公司,电子技术
计量检定员（工作地桂林）（西安）中国人民解放军第五七一八工厂,机械重工
人力资源实习生北京丽兹行房地产顾问有限公司,房地产
用户研究实习生北京易享信息技术有限公司,IT软件
运营专员（24届校招）多益网络有限公司,互联网
汽车电子工程师宁波正朗汽车零部件有限公司,汽车
审核标注助理（接受实习）易宝软件科技（南京）有限公司,IT软件
增长产品实习生北京世纪好未来教育科技有限公司,教育培训
2024届-硕士-病理技术员-宁波(安评)康龙化成（北京）新药技术股份有限公司,医疗保健
数据运营实习生深圳云天畅想信息科技有限公司,互联网
项目研发岗（项目经理）曼德电子电器有限公司,电子技术
数据运营实习生上海哈普惠科技有限公司,互联网
java开发（实习生）北京北大软件工程股份有限公司,IT软件
新媒体运营实习生上海玖康国瑞健康管理有限公司,媒体
文员上海安理创科技有限公司,中介服务
病理科分子生信分析员中国医学科学院肿瘤医院深圳医院,医疗保健
北京北元电器有限公司2024届校园招聘北京北元电器有限公司,电子技术
【校招】网络开发工程师(J11100)斑马网络技术有限公司,IT软件
DSP开发工程师杭州亿恒科技有限公司,电子技术
飞行器气动设计与仿真工程师（武汉）中船七一0,航天航空
人事综合专员(管培)沈阳银信资产管理有限公司,金融投资
嵌入式软件开发工程师苏州高新区校园空中双选会,IT软件
感知算法实习生北京魔门塔科技有限公司,IT软件
自如hr实习生、大平台（可年后到岗）北京自如住房租赁有限公司,房地产
机械技术员深圳市星源材质科技股份有限公司,机械重工
汽车质量工程师（济南）新新人力,汽车
计算机开发工程师中国电信股份有限公司安徽分公司,电信运营
电商储备干部泉州红杉根众创贸易有限公司,批发零售
工艺设计工程师（武汉）上海河图工程股份有限公司,加工制造
感知SDK开发工程师-C++北京魔门塔科技有限公司,IT软件
技术研发类广东和胜工业铝材股份有限公司,加工制造
作业帮Hr实习生作业帮教育科技（北京）有限公司,教育培训
法务中国二十二冶集团有限公司,法务
文学实习生-内容梳理与校正专家北京元石科技有限公司,媒体
背调顾问领猎教育科技（上海）有限公司,咨询服务
直播运营实习生成都高途云集教育科技有限公司,媒体
兽医师牧原食品股份有限公司,医疗保健
广州白云国际机场-公共区域巡查员广东海航幸福航空服务有限公司,物流运输
土建设计浙江西子联合工程有限公司,房地产
开发者向-编辑器产品经理实习生（可转正）北京展心展力信息科技有限公司,IT软件
焊接工程师江苏耀坤液压股份有限公司,加工制造
康复治疗师泰康之家沈园(沈阳)养老服务有限公司,医疗保健
查勘定损员华海财产保险股份有限公司,保险
校园宣传大使贝因美股份有限公司,快消
工业设计（AIGC方向）杭州造物云技术有限公司,加工制造
技术研发岗浙江哈尔斯真空器皿股份有限公司,加工制造
数字设计工程师宁波奥拉半导体有限公司,电子技术
收银接待江苏俺家小院文化发展有限公司,餐饮娱乐
工艺员石家庄市海燕包装材料有限公司,加工制造
5G软件研发工程师（2024届）南宁富联富桂精密工业有限公司,电子技术
技术深圳市前海深港现代服务业合作区管理局,政府组织
节目主持人（实习）杭州英智信息技术服务有限公司,媒体
高中英语教师徐州市第三中学,教育培训
工艺员江苏明源纺织有限公司,加工制造
FAE现场应用工程师广东鸿翼芯汽车电子科技有限公司,汽车
电话客服五险带薪培训北京人人追网络科技有限公司益阳高新分公司,生活服务
现场品控扬州品春食品有限公司,快消
采购专员江苏邦能振键机械有限公司,加工制造
综合柜员宁波银行股份有限公司苏州分行,金融投资
储备空气站运维工程师河北赛默森环保科技有限公司,环保
技术员无锡威顺煤矿机械有限公司,采掘冶炼
高中化学教师2024泗阳桃州中学,教育培训
商务专员浙江金诚拍卖有限公司,贸易
高中生物教师河北雄安博奥高级中学有限公司,教育培训
2024届-生物分析方向研究员南通药明康德医药科技有限公司,医疗保健
磁性材料计量（武汉）中船七一0,机械重工
财务管培精英佛山尊贤行控股集团有限公司,金融投资
助教-辅导员喵奥教育科技（昆明）有限公司,教育培训
客服实习生杭州多协信息技术有限公司,生活服务
管理培训生-生产管理类大咖国际2024,加工制造
青少素养教师大连新东方培训学校有限公司,教育培训
人力资源专员江苏东成机电工具有限公司,人力资源
招商交科2024届校园招聘（科研类）（9月28日9点20东南大学交通学院322会议室宣讲）招商局重庆交通科研设计院有限公司,咨询服务
技术员元谋县果然好农业科技有限公司,农业
临床药师延安大学附属医院,医疗保健
电话客服新东方教育科技集团有限公司,生活服务
义乌市帕特进出口有限公司义乌市帕特进出口有限公司,贸易
富士康放说明书一月7K深圳富联富桂精密工业有限公司,加工制造
设计运营实习生（hr方向）上海蔚来汽车有限公司,汽车
结构工程师中山旭贵明电子有限公司,电子技术
土建技术员河北载仁建筑工程有限公司,房地产
前台服务西双版纳千瑞文化传播有限公司,休闲度假
自动驾驶算法工程师江西经纬恒润科技有限公司,汽车
VR全景房源制作河北云鱼科技有限公司,互联网
楼宇自控系统维护工程师北京恒臻同远科技有限公司,环保
弱电智能化设计师浙江浙通云鼎智能科技有限公司,电子技术
硬件工程师江苏阿诗特能源科技有限公司,电子技术
销售管培生北京算能科技有限公司,金融投资
自动驾驶车辆动力学工程师（南昌）新新人力,汽车
算法实习生南京钉子网络科技有限公司,IT软件
JINS眼镜储备干部/验光师/店员-上海睛姿（上海）企业管理有限公司,医疗设备
专利工程师山东国瓷功能材料股份有限公司,认证检验
化工工艺工程师联油工业集团,化工
设计研发岗神驰机电股份有限公司,加工制造
上海-某知名外资企业-项目部韩语实习生上海岱澳人才信息咨询有限公司,咨询服务
工艺助理工程师成都京东方光电科技有限公司,加工制造
研发工程师合肥旭阳铝颜料有限公司,加工制造
ALSCRMIntern历峰商业有限公司,金融投资
党委工作干事-首开股份总部首开2024,房地产
外贸业务厦门市人才服务中心,贸易
微波设计工程师扬州宇安电子科技有限公司,电子技术
工艺员伊顿辉能低压电器（江苏）有限公司,加工制造
图形/3D视觉算法实习生网易（杭州）网络有限公司,媒体
储备失效分析工程师伯恩光学（惠州）有限公司,电子技术
邮轮西餐厅服务员威海兴亚船务有限公司,休闲度假
财务专员（2024届）华勤技术股份有限公司,金融投资
江西泰豪动漫职业学院-教学岗广州高才信息科技有限公司,教育培训
校招-钣喷中心拓展(A204467)北京罗克维尔斯科技有限公司,加工制造
韩语实习生日尚乐堂（北京）科技有限公司,媒体
小学各学科专任教师北京师范大学福清附属学校,教育培训
BD市场运营专员兰树化妆品股份有限公司,快消
海外效果广告投放实习生广州欢聚时代信息科技有限公司,媒体
（实习）财务管理共青团长沙市委,金融投资
市场实习生上海荷瑞展览有限公司,媒体
大客户代表河南益常青生物科技有限公司,医药
ai算法实习生北京猿辅导线上学科培训学校,教育培训
印染管培生（苏州）江苏拓创人力资源服务有限公司,快消
电气工程师江苏新聚环保科技有限公司,新能源
文案策划类实习生珠海原妙医学科技股份有限公司,医疗保健
机械工程师助理厘安（河南）信息技术有限公司,IT软件
延安大学西安创新学院人才招聘公告北京心力志成科技有限公司,教育培训
商业化运营实习生广州小迈网络科技有限公司,互联网
1688运营浙江卓尔雅美妆有限公司,零售
信用卡客户经理招商银行股份有限公司信用卡中心,金融投资
C#软件工程师（校招）(J10288)上海精积微半导体技术有限公司,IT软件
人力资源管培生(招聘方向)上海行动教育科技股份有限公司,人力资源咨询
高中物理老师（往届生可报）南安市本真高级中学有限公司,教育培训
数据开发实习生畅捷通信息技术股份有限公司,IT软件
数据分析/数据开发实习生晖致医药有限公司,医药
上位机软件工程师无锡信捷电气股份有限公司,IT软件
外贸业务员苏州菲镭泰克激光技术有限公司,贸易
短视频编导南京梦时文化传媒有限公司,媒体
会务会展销售杭州虔诚会务服务有限公司,会展服务
营销策划实习生深圳市欧珀通信软件有限公司,广告
应届生广东钶锐锶数控技术股份有限公司东莞分公司,加工制造
市场专员鑫联环保科技股份有限公司,环保
助理机械工程师亚新科国际铸造（山西）有限公司,机械重工
重庆应用技术职业学院2024年教师招聘计划北京高博中进信息技术有限公司,教育培训
同立集团2024校园招聘--专利工程师北京同立钧成知识产权代理有限公司,咨询服务
品牌咨询顾问广州雇者品牌咨询有限公司,咨询服务
跨境电商运营助理天津裕瑶科技有限公司,互联网
国内销售业务员（海南）上海英科实业有限公司,贸易
校招-产品经理管培生东方优选（北京）科技有限公司,IT软件
技术员阆中市土状元生态农业发展有限公司,农业
高中语文教师福州华伦中学,教育培训
角色原画设计师北京卓越晨星科技有限公司,娱乐
测试工程师（实习）飞未云科（深圳）技术有限公司,IT软件
韩语ASR标注（topik5~6级）上海坤亿信息技术有限公司,语音技术
hrbp实习生唯品会（中国）有限公司,人力资源咨询
冶金工程师（广元）河南中孚实业,采掘冶炼
综合助理辉阁(天津)文化传播有限公司,文化传媒
项目经理实习生-珠海数字广东网络建设有限公司,互联网
小红书内容运营实习生欣欣相融教育科技（北京）有限公司,教育培训
行政管理岗-德庆盈启华润水泥投资有限公司,房地产
工艺研发工程师连云港碱业有限公司,化工
研发工程师（苏州）山东海科控股有限公司,医疗设备
采购助理实习生景德镇正业新能源科技有限公司,新能源
文案/编导实习生云南华美美莱美容医院有限公司,咨询服务
招聘实习生上海优族信息技术有限公司,人力资源咨询
就差一个你啦，招大学生院校代理！！武汉市度域信创电子商务有限公司,电子商务
化妆品新品数据实习生（英语方向）广州新数智能科技有限公司,化妆品
昆明铁路局接待岗云南翔联航空服务有限责任公司,物流运输
纺织工艺管理江苏大达麻纺织科技有限公司,纺织服装
直播运营助理北京微生活电子商务有限公司,电子商务
工程部专职四川水发勘测设计研究有限公司,建筑工程
热能动力工程师南京苏夏设计集团股份有限公司,热能动力
管培生吉客印（郑州）数字科技有限公司,IT软件
版图设计工程师上海合见工业软件集团有限公司,IT软件
质量工程师苏州英维克温控技术有限公司,质量控制
MarketingIntern赛诺菲(中国)投资有限公司上海分公司,医药
进出口实习生美伊电钢（常州）机械有限公司,贸易
图书直播实习生深圳市海讯教育科技有限公司,教育培训
对话NLU实习生北京世纪好未来教育科技有限公司,IT软件
后端开发工程师灵长智能科技（杭州）有限公司,IT软件
教育产品销售上海声阅智能科技有限公司,教育培训
教师成都极客未来教育科技有限公司,教育培训
银行信用卡客服专员广东信天下经济信息咨询有限公司成都分公司,金融投资
人力资源专员/助理申通快递有限公司,物流运输
生鲜客户经理牧原食品股份有限公司,快消
营销管培生重庆觉晓科技有限公司,IT软件
售后支持顾问（24届校招）深圳市领星网络科技有限公司,IT软件
新媒体运营实习生光合新知（北京）信息技术有限公司,媒体
猎头实习生北京烁程企业管理顾问有限公司,人力资源咨询
销售人员-邢台杭银消费金融股份有限公司,金融投资
抖音后台运营助理成都世纪天语科技有限公司,互联网
这里招实习生可小白~共进科技（金华）有限公司,电子商务
新媒体运营实习生宁波激智科技股份有限公司,媒体
测试工程师（ATE）新新人力,IT硬件
字节跳动文职大连金慧融智科技股份有限公司,媒体
百匠新人-招商岗(义乌)华润置地2024届校园招聘,房地产
计算机视觉算法实习生纽劢科技（上海）有限公司,IT软件
外贸业务员江苏正恒轻工机械有限公司,贸易
设计师助理圣都家居装饰有限公司,室内装潢
软件项目经理北京数字政通科技股份有限公司,IT软件
腐蚀检测工程师天津朗朔科技有限公司,化工
初级电力电子工程师北京爱博精电科技有限公司,电子技术
初中各科教师南京金地未来学校,教育培训
法务实习生北京五八到家信息技术集团有限公司,法律服务
采购员双胞胎(集团)股份有限公司,物流运输
档案扫描人员山东山大鸥玛软件股份有限公司,IT软件
人力资源实习生（规模900+人/大公司）北京赛优职教育科技有限公司,教育培训
风控治理实习生-商业化安全北京字跳网络技术有限公司,互联网
品管员/人才储备福建长德蛋白科技有限公司,加工制造
1青岛市黄岛区人力资源和社会保障局,政府机构
销售助理光明,快消
招标实习生苏州中化药品工业有限公司,医药
设备设计师云南化工设计院有限公司,石油化工
自动化电控工程师（深圳）新新人力,IT硬件
sap实习生(长期培养)北方智企（山东）科技创新有限公司,IT软件
公司法务上海海隆软件股份有限公司,法律服务
电商运营美豪音乐集团有限公司,媒体
文职实习岗底薪3200/包住安徽喟埠檬ば畔⒖萍加邢薰司,IT软件
财务实习生龙湖物业服务集团有限公司,物业管理
助理工业设计工程师（苏州）欧圣电气2024,加工制造
视频运营实习生北京易点淘网络技术有限公司,互联网
杭州大学生幼教家教兼职杭州科匠信息科技有限公司,教育培训
汽车电子测试工程师（广州）新新人力,汽车
质量管理绍兴市安吉尔净饮水科技有限公司,环保
质量工程师江阴市羽项汽车饰件有限公司,汽车
IP验证工程师象帝先计算2024,IT硬件
CPB-TrainingIntern资生堂(中国)投资有限公司,医疗保健
养殖生产管培生唐人神集团股份有限公司,农业
市场营销（2024届校招）（长沙）中建西部建设校招,咨询服务
直播运营实习生作业帮教育科技（北京）有限公司,互联网
客服义乌市冷影文化用品有限公司,快消
市场推广江苏宏大投资有限公司,咨询服务
音乐舞蹈教师吉安长田学校,教育培训
人力资源实习生广东美的制冷设备有限公司,物业管理
外呼专员黑岩网络科技（上海）有限公司,互联网
平面设计师久盛地板有限公司,室内装潢
配方工程师青岛泰凯英专用轮胎股份有限公司,加工制造
（实习）品牌推广中心共青团长沙市委,政府机构
内容产品实习生欣欣相融教育科技（北京）有限公司,教育培训
算法研发岗（音频音效）歌尔股份有限公司,IT软件
行政助理浙江江山欣欣饲料有限公司,农业
会员运营实习生深圳市瞳学科技有限公司,互联网
市场专员无锡海斯凯尔医学技术有限公司,医疗设备
货代单证宁波达倍国际物流有限公司,物流运输
海外市场实习生上海已观科技有限公司,互联网
安卓工程师江苏文武时代教育科技有限公司,IT软件
互联网产品经理大参林医药集团股份有限公司,医药
项目执行助理广东东方麦田工业设计股份有限公司,咨询服务
湛江科技学院专任教师岗（硕士、博士层次）招聘公告北京心力志成科技有限公司,教育培训
企划岗中国人民财产保险股份有限公司盐城市分公司,保险
人力资源专员/助理祥博传热科技股份有限公司,物业管理
生产储备干部建滔（衡阳）实业有限公司,加工制造
美术老师靖江市欧西姆教育培训中心有限公司,教育培训
销售代表加绿巧食品制造业（海南）有限责任公司,快消
电商运营助理(J10043)福建植护网络科技有限公司,互联网
燃料结构设计岗(J10145)上海核工程研究设计院,石油化工
【24届实习】供应链储备管理岗（武汉）(A207095)上海识装信息科技有限公司,物流运输
业务管培生上海九州通医药有限公司,医疗保健
站外推广助理-韩语实习生易通全球跨境电商（深圳）有限公司,互联网
软件工程师（24届研究生）重庆天如生物科技有限公司,IT软件
质量工程师中国宝武2024,加工制造
活动运营实习生北京快看世界信息技术有限公司,媒体
汽车质量工程师（太原）新新人力,汽车
科研骨干（十）辽宁材料实验室,科研
测试实习生（提供转正名额）杭州数跑科技有限公司,IT软件
24届运营实习生-可转正招商银行股份有限公司信用卡中心,金融投资
人力资源实习生宁波梅山保税港区艾克思创新投资管理有限公司,人力资源
电气工程师日立安斯泰莫动力系统（南京）有限公司,电子技术
华润苏果2024届管理培训生（中高层后备苏果超市有限公司,快消
电子芯片工程师&储备管理安徽闳瑞幸成信息技术有限公司,电子技术
医药研发类天津市医药集团有限公司,医药
算法实习生上海哔哩哔哩科技有限公司,IT软件
业务经理(青岛、芜湖)广州毅昌科技股份有限公司,互联网
行政文员重庆市一方财务代理有限公司,办公用品
语音识别算法实习生北京高德云图科技有限公司,IT软件
运营专员（24校招）多益网络有限公司,互联网
第三方检测工程师大连三仪动物药品有限公司,医疗设备
药物分析方法研究员江苏慧聚药业股份有限公司,医药
往届/应届初高中各学科老师绍兴市越城区星也火信息咨询有限公司,教育培训
产品渠道助理北京太平洋加达出国顾问股份有限公司,咨询服务
物业集团-储备干部（非应届生勿扰）海力城市运营管理有限公司,物业管理
储备管理人员江苏传艺钠电科技有限公司,电子技术
集成电路IC设计/应用工程师（六安）新新人力,IT硬件
人事SSC实习生上海晨光文具股份有限公司,人力资源
营销经理储备广东海信冰箱营销股份有限公司南宁分公司,快消
校园引才大使宁波市博士后联谊会,咨询服务
人力资源专员/助理上海寻梦信息技术有限公司,人力资源
京东物流2024届新锐之星（江苏盐城-储备干部）江苏京东信息技术有限公司南通分公司,物流运输
安全管理岗中交四航局第六工程有限公司,石油化工
必胜客餐厅运营管培生-咸阳百胜餐饮（西安）有限公司,餐饮娱乐
人力资源专员江苏云睿汽车电器系统有限公司,人力资源
总体设计中电科技扬州宝军电子有限公司,电子技术
茶研发工程师杭州娃哈哈集团有限公司,快消
企业招商实习生上海识装信息科技有限公司,咨询服务
营销管培生同策房产咨询股份有限公司,咨询服务
管理实习生+培训+5000起南京简零吉颜创美科技有限公司,生活服务
物资管理岗（2024届校招）（黑龙江省）中建西部建设校招,物流运输
专利撰写实习生（电学）猪八戒股份有限公司,IT软件
2024届高校生制造类工程师昆山龙腾光电股份有限公司,加工制造
管培生类（27W-35W）广州凡岛网络科技有限公司,互联网
网络安全售前实习生内蒙古旌云科技有限公司,IT软件
部门行政助理(J41455)新东方教育科技集团有限公司,物业管理
法务销售昆明蚂蚁雄兵科技有限公司,咨询服务
操作工江苏云意电气股份有限公司,加工制造
上海大学通信与信息工程学院2023年诚聘英才！广州高才博后信息咨询服务有限公司,教育培训
项目管理专员杭州安费诺飞凤通信部品有限公司,电子技术
亚马逊运营专员凤岗天安,互联网
平面设计实习生开平市赤坎旧埠旅游发展有限公司,广告
硬件（电力电子/电源工程师）江苏安科瑞电器制造有限公司,电子技术
海外媒介实习生（日、韩语）网易有道信息技术(北京)有限公司,媒体
电气工程师无锡市阳通机械设备有限公司,电子技术
驻场运维工程师新疆华奕新能源科技股份有限公司,新能源
俄语翻译中国化学工程第七建设有限公司,服务
商品采购管培生南通市大参林医药有限公司,医药
人力实习生（包饭）北京思明启创科技有限公司,人力资源
重症医学利辛县第二人民医院,医疗保健
游戏关卡策划深圳市尚游网络科技有限公司,休闲度假
业务员南京米德西普生物科技有限公司,医疗保健
装配工艺工程师无锡丹尼克尔自动化科技有限公司,加工制造
嵌入式硬件开发工程师浪潮金融信息技术有限公司,电子技术
MES实施顾问（2024届-合肥）鼎捷软件股份有限公司,IT软件
运动控制算法工程师上海宇量N科技有限公司,电子技术
客户经理（于都）江西银行小企业信贷中心,金融投资
平潭综合实验区2024年第二批引进生公开选拔（医疗类）平潭综合实验区人才发展集团有限公司,医疗保健
数据分析厘安（河南）信息技术有限公司,IT软件
税务实习生广州欢聚时代信息科技有限公司,会计审计
储备干部衢州恒业汽车部件有限公司,加工制造
中国科学技术大学2024年英语教师招聘启事广州高才信息科技有限公司,教育培训
淘宝客服江苏北方高科电子科技有限公司,互联网
仪表作业员新浦化学（泰兴）有限公司,加工制造
招投标专员（实习生）南京诚迈智能信息科技有限公司,咨询服务
3d动作实习生（包餐/双休）广东游娱信息技术有限公司,互联网
微博知乎小红书平台运营策划编辑京报移动传媒有限公司,媒体
人力资源专员/助理河南予佳教育咨询有限公司,人力资源
渝北区！文职客服+无销售/无夜班+入职社保重庆信盟科技发展有限公司,生活服务
人事招聘（无经验也可+可实习）安徽万烽物流有限公司,物流运输
交付工程师浩鲸云计算科技股份有限公司,IT软件
生产管理浙江洁美电子科技股份有限公司,加工制造
产品设计岗上海寰宇物流科技有限公司,产品设计
软件开发珠海市智迪科技股份有限公司,IT软件
办公室文职大连佰亚欧尚传媒有限公司,咨询服务
产品研发实习生上海仙工智能科技有限公司,产品设计
苹果部门仓库周边330/天富士康科技集团有限公司,加工制造
英语实习生阿维塔科技（重庆）有限公司,媒体
肯德基储备经理（镇江）无锡肯德基有限公司,餐饮娱乐
百丽时尚青海区招募人力资源实习生陕西百丽鞋业有限公司,服装
量化实习生上海黑翼资产管理有限公司,金融投资
营业员中服（泉州）免税品有限公司,批发零售
造价（商务）工程师浙江华东工程建设管理有限公司,咨询服务
行政专员1名广州市海珠区蓝信封留守儿童关爱中心,社会服务
电气施工技术员四川中核利原劳务有限公司,电子技术
实习生（短期）北京卓教国际科技股份有限公司,教育培训
品牌设计实习生深圳市锐尔觅移动通信有限公司,广告
审计实习生中兴华会计师事务所（特殊普通合伙）新疆分所,会计审计
内贸业务员宁波国琅机器人科技有限公司,批发零售
储备干部宁波先锋电器制造有限公司,加工制造
设备/电气/仪表储备生卫星化学股份有限公司,加工制造
行政实习生深圳智慧园区运营服务有限公司,办公用品
