投放运营实习生广州兴趣岛信息科技有限公司,互联网
线上外卖运营厦门快乐番薯实业有限公司,餐饮娱乐
规划设计师中铁置业集团上海投资发展有限公司,房地产
水土保持黑龙江农垦勘测设计研究院有限公司福建分公司,农业
机电一体化上海宝信软件股份有限公司,机械重工
增长营销实习生北京快看世界信息技术有限公司,广告
人力实习生北京数聚智连科技股份有限公司,人力资源
AI视觉及AIGC图片生成算法实习生深圳匠韵智能有限公司,人工智能技术
安全环保类藏格矿业股份有限公司,环保
达人商务BD实习生诺狐（深圳）儿童用品有限公司,快消
产品专员实习生―2024届校招广州小迈网络科技有限公司,互联网
会开车销售+外勤安装+不地推+月入2万可兼职上海中宏翊琛网络科技有限公司,物流运输
车身设计工程师（滁州）新新人力,汽车
新媒体运营实习生叽里呱啦文化传播（上海）有限公司,媒体
电商客服专员南京索菲思电子科技有限公司,电子技术
渠道开发支持实习生(H4031)北京小米移动软件有限公司,互联网
语文安乡县金海教育咨询有限公司,教育培训
财经管理岗双胞胎(集团)股份有限公司,金融投资
【2024届】光学测试工程师趵突泉实验室,医疗设备
储备干部（生产品控）牧原食品股份有限公司,快消
线上面试拿了OFFER来上海＋互联网金融＋月薪过万中美联泰大都会人寿保险有限公司上海分公司,金融投资
设计实习生-平面设计(J10429)宁波凯越集团有限公司,媒体
材料研发工厂师南通创亿达新材料股份有限公司,化工
UI设计实习生(APP)广州点金石信息技术有限公司,IT软件
Java实习开发工程师北京世纪好未来教育科技有限公司,IT软件
算法实习生上海脑虎科技有限公司,IT软件
搜索产品研发_多模态生成大模型算法实习生百度在线网络技术（北京）有限公司,IT软件
技术员浙江华仪电子股份有限公司,电子技术
算法研发岗（工业/机器人）歌尔股份有限公司,机械重工
行业研究实习生北京蓝驰投资管理有限公司,金融投资
管培生温州市美拉五金有限公司,加工制造
制程工程师（3D打印）杭州安费诺飞凤通信部品有限公司,加工制造
业务经理（上海）中德生态园,房地产
安环工程师泰盛科技（集团）股份有限公司,石油化工
生产储备宁波金鸡强磁股份有限公司,加工制造
机械设计工程师江苏精研科技股份有限公司,机械重工
长安区独栋办公楼双休法休稳定/金融实习生河北源达信息技术股份有限公司,金融投资
工艺工程师南通中集能源装备有限公司,加工制造
外贸业务员温州海舟进出口有限公司,贸易
综合柜员宁波银行股份有限公司杭州分行,金融投资
【事业编制】城市更新和建设服务中心中共中山市南头镇委员会党建工作办公室（中共中山市南头镇委员会组织人事办公室）,房地产
业务储备干部成都中鑫信投企业管理有限公司重庆分公司,物流运输
麻醉医生利辛县人民医院,医疗保健
冶炼技术协理（山东鑫海）中国宝武2024,采掘冶炼
留学文案北京新东方前途出国咨询有限公司徐州分公司,教育培训
口腔科医师安徽医科大学第二附属医院,医疗保健
采购文员维发电子科技（常州）有限公司,加工制造
人力行政专员【党员】北京新知百略科技有限公司,咨询服务
运营实习生【居家办公/抖音电商】山西坦重晟文化传媒有限公司,快消
研发序列青岛高测科技股份有限公司,IT硬件
品牌设计专员福州迈新生物技术开发有限公司,咨询服务
骨外科医师厦门市人才服务中心,医疗保健
岩土工程技术员上海汇谷岩土工程技术有限公司,环保
软件开发工程师快克智能装备股份有限公司,IT软件
营销管培生厦门立林科技有限公司,广告
人工智能机器学习与大数据管培实习公义法正信息技术(广东)有限公司,IT软件
嵌入式应用开发实习生深圳市万莫斯科技有限公司,IT硬件
研发质量工程师（储备）珠海浩盛标签打印机有限公司,加工制造
技术研发岗江苏常发实业集团有限公司,加工制造
销售经理/主管云南海浪新能源科技有限公司,新能源
校招-CRC临床研究协调员-成都比逊（广州）医疗科技有限公司,医疗保健
工业工程师昆山捷奥比机械发展有限公司,机械重工
人力资源实习生上海正弘建设工程顾问有限公司广东分公司,咨询服务
B端产品实习生北京百度网讯科技有限公司,互联网
测试员浙江恒捷通信科技有限公司,电子技术
人力资源实习生（薪酬方向）(J10234)伊之密股份有限公司,咨询服务
2024届财务管培生荣万家生活服务股份有限公司南京分公司,金融投资
新能源汽车电机开发工程师（苏州）新新人力,新能源
web前端开发工程师深圳市杉岩数据技术有限公司,IT软件
培训运营专员(A30445)北京罗克维尔斯科技有限公司,教育培训
编剧南京硬腿子网络科技有限公司,媒体
党群干事中储南京智慧物流科技有限公司,物流运输
市场营销-链家置地总部直聘北京链家置地房地产经纪有限公司海淀八里庄路分公司,房地产
新东方江苏省域24届校招-文化大使（文旅类）南京新东方文化艺术发展有限公司,教育培训
数学老师常州市新北区树之优教育培训中心有限公司,教育培训
行李员昆明春城湖畔旅游置业发展有限公司,旅游
2024122-技术员新疆维吾尔自治区阿克苏地区人力资源和社会保障局,政府机关
商务开发助理厚成人力资源集团有限公司,咨询服务
英文质检实习生未有(武汉)科技有限公司,咨询服务
室内设计师助理福州天外天艺术设计有限公司,室内装潢
家装设计师上海齐屹信息科技有限公司,室内装潢
产品专员/助理上海埃维汽车技术股份有限公司,汽车
工程检测师机械工业勘察设计研究院有限公司,机械重工
预审员上海安理创科技有限公司,认证检验
理科教师重庆市九龙坡区千豪艺术培训有限公司,教育培训
人资实习生南京银城物业服务有限公司,物业管理
软件工程师（电池管理系统方向）阿特斯储能科技有限公司,IT软件
催收员深圳万乘联合投资有限公司青岛分公司,金融投资
研发工程师湖北菲利华石英玻璃股份有限公司,加工制造
档案管理实习生合肥优势甄选信息科技有限公司,咨询服务
产品经理实习生北京轻松筹网络科技有限公司,互联网
UE虚幻引擎开发实习生太仓中科信息技术研究院,IT软件
自动化技术员安徽英科医疗用品有限公司,自动化
数据库内核研发工程师-济南（2024届校招）云和恩墨（北京）信息技术有限公司,IT软件
实习编导北京众和创领管理咨询有限公司,媒体
岩土工程勘察山东鲁勘集团有限公司,采掘冶炼
技师（康复科）宁国市中医院,医疗保健
电话邀约客服重庆市正乐怡佳汽车销售服务有限公司,汽车
生产管培生江西乾照光电有限公司,加工制造
3D次世代场景设计（实习生）察亚科技（杭州）有限公司,IT软件
研发岗位（光学工程师/光机工程师/机械结构工程师/电子开发工程师/感知算法工程师/系统工程师/质量工程师/工艺工程师）图达通智能科技（苏州）有限公司,IT硬件
服务工程师（24届校招）苏州天准科技股份有限公司,加工制造
销售专员星恒电源股份有限公司,批发零售
化验室技术助理慈溪市中油润滑科技有限公司,化工
英语文案编辑（实习）武汉创缘科技有限公司,媒体
生物分析研究员东曜药业有限公司,医药
苹果部门仓库周边330/天富士康精密组件（深圳）有限公司,加工制造
高中化学淮北市龙兴中学,教育培训
高中学科教师河北外国语学院附属中学有限公司,教育培训
储备干部云南强林乐家连锁便利店有限公司,加工制造
药剂科干事南京鼓楼医院集团仪征医院,医疗保健
销售管理岗位牧原食品股份有限公司,批发零售
人力资源实习生北京自如住房租赁有限公司,物业管理
产品规划实习生中电云计算技术有限公司北京分公司,IT软件
测试开发工程师（校招）南京汉隆科技有限公司,IT硬件
招聘及系统流程实习生汉高(中国)投资有限公司,金融投资
数据分析岗新华人寿保险股份有限公司绍兴中心支公司,金融投资
行政专员/助理北京中交兴路信息科技股份有限公司,物流运输
助理客户主任广东因赛品牌营销集团股份有限公司,广告
行政前台实习生可转正成都启达优才科技有限公司,物业管理
数据标注/AI训练师宁波将才云集网络科技有限公司,互联网
财务管理实习生科锐尔人力资源服务（苏州）有限公司,金融投资
高级数学标注成都小咖智数科技有限公司,教育培训
珠宝销售顾问（万象城）南宁市瑞大福珠宝有限责任公司,批发零售
无锡华清医院无锡华清医院有限公司,医疗保健
实施顾问（24届应届生）深圳市企企通科技有限公司,IT软件
人力资源实习生传播大脑科技（浙江）股份有限公司,咨询服务
工艺外操技术员江苏泓海能源有限公司,石油化工
数据分析实习生上海集度汽车有限公司,汽车
马达开发项目管理大金（中国）投资有限公司苏州研发分公司,金融投资
前端开发实习生杭州华鲤智能科技有限公司,IT软件
生猪销售交付岗双胞胎（集团）股份有限公司,农业
16949体系咨询师山东中邦北方管理咨询有限公司,咨询服务
管道技术仪征核建劳务有限公司,石油化工
算法工程师中国电信股份有限公司安徽分公司,电信运营
Java开发工程师浩云科技股份有限公司,IT软件
ui实习生大参林医药集团股份有限公司,医药
销售代表江苏超万轴承科技有限公司,批发零售
建筑暖通设计、市政供暖管网设计、市政热力系统设计第九师联拓勘测设计研究有限公司,环保
销售部协调员宁沪置业（昆山）有限公司酒店管理分公司,房地产
通信算法开发工程师华为技术有限公司,电信设备
语音产品运营上海稀宇极智科技有限公司,互联网
商务运营岗（社会实践生)重庆小米消费金融有限公司,金融投资
24届招聘专员储备（负责招聘一线车间人员）浙江盾安人工环境股份有限公司,物业管理
硬件工程师深圳市维海德技术股份有限公司,电子技术
人力资源实习生国盛证券有限责任公司,金融投资
产品研发工程师南通智峰电力技术有限公司,新能源
前端开发工程师青岛海尔人力资源开发有限公司,IT软件
康冠科技2024届春季校园招聘岗位深圳市康冠科技股份有限公司,新能源
内科淮安市妇幼保健院,医疗保健
行政财务实习生广东博雅公共关系有限公司北京分公司,咨询服务
销售工程师青岛普洛斯科技有限公司,机械重工
研发工程师开山控股集团股份有限公司,采掘冶炼
产品项目实习生北京魔门塔科技有限公司,IT软件
机械工程师广州市方瞳科技有限责任公司,机械重工
储备客服主管百秋,电信运营
算法工程师武汉楚兴技术有限公司,IT软件
英语跟单员晨风集团股份有限公司,快消
运营实习生北京网聘信息技术有限公司,互联网
直播运营实习生北京红松在线科技有限公司,媒体
实习应届【工程师助理】硬件测试白班包吃住深圳富泰宏精密工业有限公司,加工制造
项目经理（上海）欧圣电气2024,电力水利
武器研发（硕士））江苏永康机械有限公司,机械重工
人力资源管理江苏永辉水利工程设计有限公司,环保
核电厂生产技术管理岗中电投广西核电有限公司,新能源
四川省生态环保集团-四川发展（控股）旗下最大省属企业-人力资源实习生招聘四川发展(控股)有限责任公司,环保
药物合成研发技术员浙江宏元药业股份有限公司,医药
仓库主管桂林市双胜信息咨询有限公司,物流运输
高中物理老师北附广南实验学校,教育培训
工业机器人应用与维护一体化、食品营养、心理健康、历史佛山市高明区高级技工学校,教育培训
销售内勤江苏中泰检测检验有限公司,批发零售
抖音运营实习生（24届/可转正）广州域外科技有限公司,互联网
C/C++研发工程师深圳市兴海物联科技有限公司,IT软件
java实习工程师中软国际科技服务有限公司,IT软件
财务实习生上海快仓智能科技有限公司,金融投资
数据标注实习生重庆文德数字科技有限公司杭州分公司,认证检验
微博电景-产品运营实习生新浪网技术（中国）有限公司,媒体
国际解决方案经理长沙简聘信息科技有限公司,咨询服务
车辆工程管培生中质智通检测技术有限公司,认证检验
人力资源实习生广州小迈网络科技有限公司,金融投资
管培生（大客户管理方向）上海钢联物流股份有限公司,物流运输
外贸业务员三房巷集团有限公司,贸易
QC技术工程师扬子江药业集团有限公司,医药
光电芯片设计师中国科学院上海光学精密机械研究所,电子技术
流程专员C日语（财务）简柏特（大连）有限公司,认证检验
博士后研究员联宝（合肥）电子科技有限公司,IT硬件
模具设计学徒力鼎汽车零部件（江门）有限公司,加工制造
文案策划专员北京聚能美育教育科技有限公司,媒体
招聘实施／交付工程师见习岗北京新桐环保工程有限公司,环保
市场调研实习生南京古田化工有限公司,快消
后端研发工程师北京字跳网络技术有限公司,IT软件
前厅迎宾苏州市吴江东太湖大酒店有限公司,餐饮娱乐
项目电气专业技术员中国能源建设集团江苏省电力建设第一工程有限公司,电力水利
党务实习生青岛海滨实业有限公司,中介服务
接受24届实习，双休不加班+起薪5000！小船出海教育科技(北京)有限公司,教育培训
运营助理实习生（张大大团队）北京无忧乐道科技有限公司,互联网
商务管培生浙江省对外服务有限公司杭州分公司,咨询服务
数据标注实习生深圳润光智行科技有限公司,认证检验
上海地铁安检员睦航航空股份有限公司,物流运输
营销定向生宁波银行股份有限公司嘉兴分行,金融投资
医学助理华润博雅生物制药集团股份有限公司,医疗保健
IMC(Consumer/Lifestyle)PR实习生埃培智市场咨询（上海）有限公司上海分公司,咨询服务
【实习首选】提供住宿+实习盖章+朝九晚六泰盈科技集团股份有限公司,互联网
客服专员杭州瑞山电子商务有限公司,电子技术
网易新闻UGC内容运营实习生网易(杭州)网络有限公司,媒体
影视后期制作实习生依山一味（山西）科技有限公司,媒体
销售部东莞市莱瑞精密制造科技有限公司,机械重工
施工图深化设计师（展览展示）丝路视觉科技股份有限公司北京分公司,媒体
增长运营实习生(J69098)百度在线网络技术（北京）有限公司,互联网
工艺工程师（增材制造方向）南京英尼格玛工业自动化技术有限公司,加工制造
产品实习生上海哔哩哔哩科技有限公司,互联网
结构设计工程师上海同丰工程咨询有限公司,咨询服务
行政部、党建部实习生国信期货有限责任公司,金融投资
医学影像算法实习生美的集团（上海）有限公司,医疗设备
校招―创意设计师(投递请附带作品集)名创优品（广州）有限责任公司,批发零售
人力实习生元气森林（北京）食品科技集团有限公司,医药
汽车电子测试工程师（常熟）新新人力,汽车
产品拓展专员广州虹科电子科技有限公司,电子技术
会计哈尔滨汽轮机厂有限责任公司,会计审计
产品运营实习生双休不加班武汉又又科技有限公司,互联网
新媒体运营专员北京舞研艺美教育咨询有限公司,媒体
生产助理浙江盛迈电气技术有限公司,机械重工
高级儿童成长陪伴师上海超征熙家政服务有限公司,生活服务
财经法律、社会学类（成都）藏格矿业,采掘冶炼
新媒体剪辑上海齐屹信息科技有限公司,媒体
国际业务开发经理贵州捷盛钻具股份有限公司,石油化工
排污许可技术人员河北省众联能源环保科技有限公司,环保
项目工程师浙江方圆电气设备检测有限公司,电力水利
游戏原画实习生广州联曼信息科技有限公司,互联网
实习-游戏UI实习生船岛科技(上海)有限公司,互联网
人力资源专员/助理潮州市白马荟文化传播有限公司,金融投资
实习生+双休广州宏逸源企业管理有限公司,金融投资
管培生（业务、HRBP、行政方向）北京极致车网科技有限公司,互联网
市场运营实习生混沌时代(北京)教育科技有限公司,教育培训
销售攻坚组白象食品股份有限公司,快消
采购管理储备干部大亚（江苏）地板有限公司,物流运输
储备干部（1）广东慧康医疗科技有限公司,医疗保健
5g网络优化工程师重庆信科通信工程有限公司,电信设备
储备干部（技术中心总监）南阳鼎泰高科有限公司,机械重工
高铁VIP接待中运铁路运营管理（云南）有限公司,物流运输
中国地震局地球物理研究所博士后招收公告中国地震局地球物理研究所,环保
法务实习生北京中税网控股股份有限公司,金融投资
人资资源招聘实习生无锡芳星信息技术有限公司,金融投资
hr招聘实习生百度在线网络技术（北京）有限公司,互联网
法律实习生北京市君泽君（上海）律师事务所,法律
媒介实习生北京海唐新媒文化科技股份有限公司,媒体
机械设计师江苏新聚环保科技有限公司,机械重工
底盘主动悬架系统设计（南昌）新新人力,汽车
销售助理江苏科达精密机械设备有限公司,机械重工
电商管培生（运营岗、商品岗）厦门与狼共舞时装有限公司,服装
环保检测员新沂大江化工有限公司,石油化工
市场运营实习生（温州/实习证明）新东方教育科技集团有限公司,教育培训
测试开发工程师-国际电商北京抖音信息服务有限公司,互联网
素养班课人文创作教师深圳学而思教育科技有限公司,教育培训
射频工程师成都时谱科技有限公司,电子技术
生产管理岗（8-10K）生益电子股份有限公司,电子技术
主播苏州黑鲸鳍文化传媒有限公司,媒体
电商产品实习生华为技术有限公司,IT软件
营销管培生牧原食品股份有限公司,快消
西门子医疗-亚太IT合规和业务伙伴实习生西门子医疗系统有限公司,医疗设备
招聘人事实习生武汉杰豹教育培训有限责任公司,教育培训
薪资高+包吃包住+活轻松前厅水吧服务员上海中宏翊琛网络科技有限公司,餐饮娱乐
数据合规实习生(J12603)上海合合信息科技股份有限公司,IT软件
跨境电商运营(校招通道）中南万象（厦门）贸易有限公司,贸易
实习主播江西汇仁药业股份有限公司,医药
电商活动运营实习生深圳虾皮信息科技有限公司,互联网
NLP算法实习生上海一谈网络科技有限公司,IT软件
NS管培生（核保核赔）中国平安人寿保险股份有限公司宁波分公司,保险
嵌入式软件/硬件开发工程师上海京硅智能技术有限公司,电子技术
营销工程师北京洁尔爽高科技有限公司,咨询服务
硬件开发工程师深圳市智然度科技有限公司,IT硬件
电商文案策划宁波市零伍集市网络科技有限公司,互联网
家庭服务工程师中移铁通有限公司西双版纳分公司,物流运输
电气设备安装技工广东联兴建设有限公司,建筑
动画原画师成都艾尔平方文化传播有限公司,媒体
售后运维工程师盛视科技股份有限公司,IT硬件
运行管理事业部项目管理岗新华发电2024,新能源
行政实习生合肥拓普网络系统工程有限责任公司,IT软件
内容运营实习生（大宅家装设计）尚层装饰（北京）有限公司,房地产
土建工程师中石化工建设有限公司,房地产
专利工程师、检索分析师北京同立钧成知识产权代理有限公司杭州分公司,认证检验
黄山学院人才公开招聘预公告北京神州硕博信息技术有限公司,教育培训
内容运营实习生四川茶姬企业管理有限公司,媒体
管培生（市场方向）天津成科传动机电技术股份有限公司,机械重工
行政销售助理山东中科未来星教育科技有限公司,教育培训
材料员岗（唐山）港航校招,物流运输
集成电路IC设计/应用工程师（临沂）新新人力,电子技术
2024届-博士-细胞培养工艺开发-宁波康龙化成（宁波）科技发展有限公司,医药
实验室检测利郎（中国）有限公司,医疗设备
硬件测试工程师广东旭诚科技有限公司,IT硬件
新媒体运营专员成都微鑫通时代科技有限公司,媒体
电仪工程师衢州五洲特种纸业股份有限公司,电力水利
猎头实习生（金融量化方向）浙江阿尔法人力资源有限公司,金融投资
校招实习生5000包住/互联网大平台氛围超好珍岛信息技术（上海）股份有限公司,互联网
数学策划编辑（科学数理分社）中国科技出版传媒股份有限公司,媒体
产品规划岗周大生珠宝股份有限公司,服装
品控主管（培训生）江苏岳艾生物科技有限公司,快消
空间设计师久盛地板有限公司,室内装潢
社群运营(下午上班/工作餐/轻松过万)苏州殊华言文化科技有限公司,餐饮娱乐
FILA零售管理岗（江苏省&浙江省&安徽省）斐乐服饰有限公司,服装
产品运营联想(北京)有限公司,电子技术
人力资源管理实习生湖南省财信资产管理有限公司,人力资源
病理科医师、影像科医师、超声科医师、心电图医师、核医学科医师、检验科技师、药学部药师苏州市第九人民医院,医疗保健
实习生（FPGA方向）深圳市卓驭科技有限公司,IT硬件
游戏特效设计师广州古藤动漫科技有限公司,娱乐
猎头实习生同道精英(天津)信息技术有限公司苏州分公司,咨询服务
技术支持工程师深圳触觉智能科技有限公司,IT硬件
现金会计江苏红点优家电子商务有限公司,会计审计
重庆公共运输职业学院招聘北京心力志成科技有限公司,物流运输
生物教师禹城外国语实验高中,教育培训
区域能源运营实习生上海蔚来汽车有限公司,新能源
HR实习生抖音视界有限公司,人力资源
合同语料标注工程师北京北大英华科技有限公司,认证检验
结构工程师(J10975)特来电新能源,新能源
机械管理（2024应届）上海建工四建集团有限公司,加工制造
风险实习生（车辆评估）平安车管家服务有限公司,保险
课程顾问北京华图宏阳教育文化发展股份有限公司大理分公司,教育培训
产品专员浙江戴安日用品有限公司,快消
董事长助理（管培生）北京千喜鹤餐饮管理有限公司,餐饮娱乐
继电保护助理工程师苏州市钿丰电气工程有限公司,电力水利
环境监测工程师河南佳智环保科技有限公司,环保
hr招聘实习生数字马力（杭州）信息技术有限公司,人力资源
质量工程师石家庄先楚核能装备股份有限公司,机械重工
融资项目管理岗牧原食品股份有限公司,快消
游戏平面设计实习生赤子城网络技术（北京）有限公司,娱乐
2024届校招-前端开发工程师北京向上一心科技有限公司,IT软件
高校医学影像教师山东协和学院,教育培训
行政实习生上海翻酷科技有限公司,IT软件
汽车涂装工、汽车装配工、汽车外观检查工南京长安汽车有限公司,汽车
仓储运营管培生上海禹璨信息技术有限公司,物流运输
石家庄县区-兼职华图教育科技有限公司,教育培训
实习生首汽租赁有限责任公司合肥分公司,物流运输
OA实施实习（24届+可留用）泛微网络科技股份有限公司,IT软件
深圳地铁巡查员深圳市福田区保安服务有限公司,物业管理
小学辅导老师江西省纳贤教育科技有限公司,教育培训
电子硬件类/嵌入式软件类/图像算法类/机器视觉与系统类浙江势通机器人科技有限公司,电子技术
功能测试实习生深圳富联富桂精密工业有限公司,IT硬件
网络安全实习生（福州）北京中科全安技术有限公司,电信运营
中国学生计划-HRIntern汇丰银行(中国)有限公司,金融投资
新媒体运营深圳市猫员外餐饮管理有限公司,餐饮娱乐
总务行政专员大金空调（苏州）有限公司,家具家电
销售工程师金华康扬环境科技有限公司,环保
质量技术支持中诺凯琳医药发展（苏州）有限公司,医疗设备
财务部实习生互联网域名系统北京市工程研究中心有限公司,会计审计
