空间/素材设计师（实习生）广东三维家信息科技有限公司,室内装潢
服务运营实习生北京自如住房租赁有限公司,物业管理
旅游策划师陕西国起文化传媒有限公司,旅游酒店
人力招聘专员上海隆程国际货物运输代理有限公司,人力资源
文员东莞市创照灯具有限公司,生活服务
猎头实习生(留用)上海复讯信息咨询有限公司,中介服务
数据运营实习生上海哈普惠科技有限公司,互联网
全案设计师菏泽碧玉装饰有限公司,室内装潢
研发工程师南亚新材料科技股份有限公司,新能源
内容运营实习生广州埋堆堆科技有限公司,互联网
人事招聘实习生北京思明启创科技有限公司,人力资源
采购储备生釜川（无锡）智能科技有限公司,采掘冶炼
ERP实施技术管培生（厦门、广州、山东青岛、泉州丰泽、泉州德化）厦门亿星软件有限公司,IT软件
技术服务工程师苏州苏净环保新材料有限公司,环保
天线射频工程师锐仕方达（天津）人力资源有限公司,电信设备
销售工程师成都永益泵业股份有限公司,汽车
客服实习生（短期）百纳互动网络（福建）有限公司,生活服务
高中各科教师（莆田市微铭高级中学）福建微铭教育科技有限公司,教育培训
生产制造储干德诚珠宝集团有限公司,加工制造
市场专员（实习）上海诺生医疗科技有限公司,医疗设备
助理工程师博迈科海洋工程股份有限公司,航天航空
硬件工程师江苏云睿汽车电器系统有限公司,IT硬件
地质工程、水文地质与工程地质、勘查技术、岩土工程、水利水电工程、农田水利工程鼎正建筑设计有限公司新疆分公司,水利水电工程
高中语文教师顺平县博文高级中学有限公司,教育培训
工程技术工程师龙之旅华人（北京）教育科技有限公司,教育培训
HR实习生-招聘方向北京三快在线科技有限公司,人力资源
销售（广州）（实习生）微泰医疗器械（杭州）有限公司,批发零售
电气仪表工程师（赣州）寒锐钴业1,电子技术
量化开发实习生(A204374)北京未来通证科技有限公司,金融投资
无线通信开发工程师北京环佳通信技术有限公司,电信设备
设备实习生中环中清（安徽）新能源光伏科技有限公司,新能源
化学分析工程师江苏恒誉环保科技有限公司,环保
土建监理员南京长江工程监理有限公司,建筑设计
储备干部管培生（研发/产品/交付/营销）鼎捷软件股份有限公司,IT软件
能源管理上海德福伦新材料科技有限公司,新能源
外贸会计重庆市环宇汽车销售有限责任公司,贸易
助理景观设计师中建市政工程设计咨询（苏州）有限公司,建筑设计
销售顾问云南企会元财务管理咨询有限公司,金融投资
研发类上海期货交易所,金融投资
光学工程师广州德擎光学科技有限公司,电子技术
视觉设计师（如皋）梦百合家居科技股份有限公司,室内装潢
环保技术研发江苏中车华腾环保科技有限公司,环保
IC设计工程师（工作地：苏州）（长沙）国芯科技,电子技术
数控加工软控股份有限公司,加工制造
运维实习生-商业产品与技术北京字跳网络技术有限公司,互联网
国瓷材料2024届校园招聘山东国瓷功能材料股份有限公司,化工
管培生上海昂达餐饮管理有限公司,餐饮娱乐
海外销售实习生库卡机器人(广东)有限公司,机械重工
游戏文案策划实习生网易（杭州）网络有限公司,网络游戏
5G基带开发工程师北京长j科技有限公司,通信运营
短期实习生（周末双休/带薪培训）中软国际科技服务有限公司,IT软件
供应链采购工程师（24届校招）牧原食品股份有限公司,快消
人力资源专员-薪酬福利管理方向上海龙旗科技股份有限公司,人力资源
体育教练勐腊之窗实业发展有限公司,休闲度假
空间运营实习生（财务方向）上海蔚来汽车有限公司,汽车
设备技术岗广东东粤环保科技有限公司,环保
物理（初中/高中）徐州华顿国际学校,教育培训
商务解说重庆助友创美物业管理有限公司,物业管理
抖音电商运营实习生地坪线（北京）科技有限公司,互联网
机械工程师杭州新坐标科技股份有限公司,机械重工
人力资源实习生(招聘方向)深圳市科陆电子科技股份有限公司,人力资源
高中地理教师茂名市博达天骄教育咨询有限公司,教育培训
网络测试实习生无锡沐创集成电路设计有限公司,IT硬件
市场营销岗位南通大通宝富风机有限公司,市场营销
投资助理广州经传多赢投资咨询有限公司,金融投资
HR实习生美的集团电子商务有限公司,人力资源
业务运营实习生上海及未科技有限公司,互联网
大学实习/提供吃住/高薪/周末休息泰盈科技集团股份有限公司,物流运输
生产技术员苏州能讯高能半导体有限公司,电子技术
品宣部实习生西安深信科创信息技术有限公司,咨询服务
韩语运营实习生亿睿科信息技术（北京）有限公司,互联网
会计中铁城建集团华东建设有限公司,会计审计
自动化设备工程师上海捷润通机械有限公司,自动化
建行外呼客服长沙拓银电子科技有限公司,客服
外贸业务员宁波酶赛生物工程有限公司,批发零售
数据标注实习生浙江有数数字科技有限公司,IT软件
持有高压氧操作证书医师上海杨思医院,医疗保健
外贸经理助理佛山市橡尚装饰新材料有限公司,外贸
电机设计工程师上海电气集团上海电机厂有限公司,电子技术
链家总部底薪5500直聘房产经纪人/储备干部四川链家房地产经纪有限公司,房地产
角色模型实习生（手绘）完美世界（北京）软件科技发展有限公司,娱乐
应届生（汉语言文字/历史学/新闻/广告学/市场营销）东莞市诗礼雅文化创意有限公司,媒体
双休-无责3K银行坐席客服成都中鑫信投企业管理有限公司重庆分公司,金融投资
汽车底盘工程师（成都）新新人力,汽车
电气工程师、智能制造工程师江西万弘高新技术材料有限公司,电子技术
射孔技术岗绵阳卓宁网络科技有限公司,石油化工
用户运营作业帮教育科技（北京）有限公司,教育培训
市场部业务代表管培生8k+（接受无经验）太平洋房地产经纪有限公司,房地产
电子软件工程师芜湖安瑞光电有限公司,电子技术
伺服驱动工程师中科微至科技股份有限公司,电子技术
制剂研究员沈阳兴齐眼药股份有限公司,医药
结构工程师宁波南星汽车部件有限公司,汽车
招聘实习生焦点科技股份有限公司,人力资源
销售助理管培生/有带教深圳市乐有家控股集团有限公司,服装
天等县高中学校心理健康教师广西崇左市天等县教育局,教育培训
研发工程师杭州新坐标科技股份有限公司,IT软件
营销管培生牧原食品股份有限公司,快消
产品实习生作业帮教育科技（北京）有限公司,教育培训
设计实习生孩子王儿童用品股份有限公司,服装
24商品储备生鸿星尔克(厦门)实业有限公司,快消
项目实习生深圳博士创新技术转移有限公司,咨询服务
安全环保岗-贵港装配式华润水泥投资有限公司,环保
产品工艺/制程工程师绍兴浙玮汽车电子有限公司,汽车
运行检修岗中广核新能源投资（深圳）有限公司北京分公司,环保
品牌设计实习生武汉利楚商务服务有限公司,媒体
直播运营/产品运营深圳市禅游科技股份有限公司,互联网
项目运营实习生光合新知（北京）信息技术有限公司,IT软件
电池热管理工程师（无锡）新新人力,新能源
仪器仪表销售工程师（杭州）西励科技,电子技术
底盘主动悬架系统设计（江苏省）新新人力,汽车
悬架转向工程师（南通）新新人力,汽车
焊接技术员（超低温24届校招）中船鹏力（南京）科技集团有限公司,加工制造
实习会计山东瑞云财税服务有限公司,会计审计
医师、物理师、技师甘肃省肿瘤医院,医疗保健
技术储备干部宁波市创源光伏科技有限公司,新能源
营销专员上海企莲商贸有限公司,市场营销
前端开发工程师上海得帆信息技术有限公司,IT软件
商务专员上海聚信海聚新能源科技有限公司,新能源
业务运营管理实习生(NSC)(A242399)上海蔚来汽车有限公司,汽车
HR（招聘方向，24届毕业生）网新科技集团有限公司,人力资源
管培生（科研开发-博士-建筑材料方向）（上海）浙建集团,房地产
社群运营杭州安步汽车科技集团有限公司,互联网
CEO管理培训生浙江三生蔓迪药业有限公司,医疗保健
风电运维工程师甘肃金蓝优创国际企业管理服务有限公司,新能源
销售管培生无责底薪4200浙江华企信息科技有限公司南通分公司,服装
研发销售代表宁波圣润新材料有限公司,化工
地理信息技术员重庆江源工程勘察设计有限公司,环保
销售代表（赣州信丰）湖南一丰粮油有限公司,批发零售
电池片研发工程师苏州高新区校园空中双选会,新能源
财务会计专员福建省亚非进出口贸易有限公司,会计审计
AI绘画实习生武汉游戏群科技有限公司,娱乐
岩土工程勘察与设计内蒙古交通设计研究院有限责任公司,建筑
新能源电池工程师（广州）新新人力,新能源
销售（深圳）（实习生）微泰医疗器械（杭州）有限公司,医疗设备
研发技术类明阳智慧能源集团股份公司,新能源
投放助理重庆麦芽传媒有限公司,广告
外企-视频剪辑实习生德中工商技术咨询服务(太仓)有限公司广州分公司,媒体
理财顾问（期货电销/全职）重庆中旗晟鸿网络科技有限公司,金融投资
音乐商务推广音湃氪文化传播(上海)有限公司,娱乐
三维maya天津市硕恒科技发展有限公司,广告
产品研发工程师中国一拖集团有限公司,加工制造
服务工程师江苏永沃机械工程设备有限公司,机械重工
网络推广专员北京齐步科技有限公司,互联网
采集实习生苏州核数聚信息科技有限公司,IT软件
短期/XM纯打字岗位/可实习/五险/住宿/食堂河北博岳通信技术股份有限公司,电信运营
自动控制工程师（上海）新新人力,自动化
销售业务员山东宏桥新型材料有限公司,化工
直播运营实习生（提供转正机会）鸣奇科技（广州）有限公司,互联网
安全管理中核华辰建筑工程有限公司,环保
销售顾问北京伯威克科技有限公司,服装
杭州大学生初中科学（物理、化学、生物）家教兼职杭州科匠信息科技有限公司,教育培训
游戏测评实习生（阴阳师）网易（杭州）网络有限公司,网络游戏
篮球教练（南京市内就近安排）南京美驰诚体育文化传播有限公司,休闲度假
万物生（管培生）-工程类招聘万物云空间科技服务股份有限公司,新能源
国内陆用发电市场销售员重庆速宾机电设备有限公司,新能源
综合管理岗（管培生）沈阳芯源微电子设备有限公司,电子技术
2024校园招聘-蔚来顾问（销售）上海蔚来汽车有限公司,汽车
咨询顾问安徽网博智能科技有限公司,咨询服务
财务助理（包吃住，可转正）广州中味餐饮服务有限公司,服装
「校招」算法工程师-NLP（提供京户）中国民航信息网络股份有限公司,航天航空
系统维护南京市明洁国际货运代理有限公司,物流运输
产品经理实习生(A107930)安徽华米信息科技有限公司,IT软件
市场营销-晋升快-收入高北京链家置地房地产经纪有限公司海淀八里庄路分公司,房地产
现场运营可至（深圳）控股集团有限公司,房地产
大学教师北京心力志成科技有限公司,教育培训
行业应用架构设计相关岗位江苏移动,互联网
百胜餐饮浙江总部前台实习生上海必胜客有限公司浙江分公司,餐饮娱乐
销售工程师天津百利铭泰包装有限公司,加工制造
新能源电控工程师（江苏省）新新人力,新能源
采购实习生兰吉尔仪表系统（珠海）有限公司,电子技术
水务环境咨询工程师淞际环境规划设计(上海）有限公司,环保
质量管理技术员、体系审核员上海三角航空科技有限公司,航天航空
工业数据算法组_算法实习生(J69997)百度在线网络技术（北京）有限公司,IT软件
幼儿园老师宜良县匡远街道办事处晟迪幼儿园,教育培训
集成电路版图设计工程师（苏州）顺芯半导体2024,电子技术
新媒体运营实习生成都启明者留服科技有限公司,媒体
机械工程师‘豪迈集团股份有限公司,机械重工
002销售工程师（潮汕）（揭阳）绍兴市人社局,批发零售
材料方向教材图书策划编辑(J10016)化学工业出版社有限公司,媒体
验证专员济川药业集团有限公司,医药
产品运营实习生普拉瑞斯信息科技(上海)有限公司,快消
网络工程师（上海）上海华讯网络系统有限公司,电信运营
客服督学老师厦门市人才服务中心,教育培训
股份职能-采购员（设备方向）浙江京新药业股份有限公司,医药
招一起跳科目三的实习生南昌晨沛霈科技有限公司,交通运输
人力资源实习生色界美妆（广东）科技有限公司,人力资源
销售助理南京医药股份有限公司,批发零售
轮机调试服务工程师海英荷普曼船舶设备（上海）有限公司,物流运输
电气软件工程师横河电机（苏州）有限公司,电子技术
教师芜湖市教育局,教育培训
业务运营（交付方向）(A128352)北京罗克维尔斯科技有限公司,互联网
数理化英教师重庆金东方企业管理有限公司,教育培训
人力资源专员上海中谷物流股份有限公司,人力资源
高中教师、讲师、理科教师兰州奇异物之理科技有限公司,教育培训
嵌入式软件开发工程师成都美云智享智能科技有限公司,电子技术
氩弧焊工青岛谢尔得辐射防护设备有限公司,加工制造
葡萄牙语外贸业务员宁波安可佳集团有限公司,贸易
Agent沙盒算法开发实习生上海人工智能创新中心,IT软件
酒店领班榆林市榆阳区大漠军旅文化园管理有限责任公司,休闲度假
监理员南京长江工程监理有限公司,建筑
养殖生产储备干部牧原食品股份有限公司,农业
电子/电气工程师西安大医集团股份有限公司,电子技术
消化内科徐州矿务集团第二医院,医疗保健
后端开发工程师广西磐庚健康科技有限公司,IT软件
机械工程师浙江赛瑾半导体科技有限公司,机械重工
市场储备干部（淮安）江苏恒研教育科技集团有限公司,教育培训
汽车智能座舱嵌入式工程师（实习生）上海卓迈汽车技术服务有限公司,汽车
硬件助理工程师（PCB-Layout方向）深圳市华宝新能源股份有限公司,电子技术
外贸业务员扬州中天利新材料股份有限公司,贸易
文科教师上海乐悠教育培训有限公司,教育培训
营销实习生/纯大学生团队/深圳市场占有率第一深圳市乐有家房产交易有限公司,房地产
产品运营实习生上海识装信息科技有限公司,互联网
南方蔬菜研究中心科研岗中国热科院南亚所,农业
广告产品运营实习生北京三快在线科技有限公司,广告
法律合规管培生(A187548)上海极兔极致供应链管理有限公司,法律
新媒体运营（留学生）番茄红啦（北京）网络技术有限公司,媒体
国际业务部实习研究助理上海基煜基金销售有限公司,金融投资
算法工程师南京天溯自动化控制系统有限公司,IT软件
软件工程师新能动力（无锡）电气科技有限公司,IT软件
造价经济类浙建集团,建筑
数据分析师杭州智聪网络科技有限公司,IT软件
会务执行中津双创（天津）科技有限公司,会计审计
24届游戏测试（包三餐）深圳市法本信息技术股份有限公司,网络游戏
人事助理(实习生)广东善能科技发展股份有限公司,人力资源
python脚本开发实习生科大讯飞股份有限公司,IT软件
招聘专员浙江德施曼科技智能股份有限公司,人力资源
世界500强百胜中国HR实习生/做五休二招募中百胜餐饮（福州）有限公司,餐饮娱乐
培训运营东软教育科技集团有限公司,教育培训
面板设计工程师滁州惠科光电科技有限公司,电子技术
肝病科扬州市第三人民医院,医疗保健
高中历史教师昭通市正道高级完全中学,教育培训
英语运营助理实习生顺丰科技有限公司,物流运输
数据库内核研发杭州悦数科技有限公司,IT软件
前端开发实习生北京智谱华章科技有限公司,IT软件
FAE管培生广东美信科技股份有限公司,电子技术
电力运行检修大唐鲁北发电有限责任公司,电力水利
思政教师浙江横店影视职业学院,教育培训
财务核算实习生（有转正机会）北京魔门塔科技有限公司,会计审计
护理宝应县人民医院,医疗保健
总裁办投资实习生广州市德伦口腔门诊部有限公司,医疗保健
后端Java开发工程师北京算力大陆科技有限公司,IT软件
自动化工程师（储备）江苏拓创人力资源服务有限公司,自动化
外贸销售（南昌）凤岗天安,贸易
人力资源专员/助理北京四方继保自动化股份有限公司,人力资源
工程设计太原市市政工程设计研究院,建筑
华地国际2024届校园招聘-信息开发八佰伴商业管理有限公司,物业管理
弹药总体修理工（工作地桂林）中国人民解放军第五七一八工厂,国防军工
HRBP-实习生(J12728)北京思明启创科技有限公司,人力资源
结构工程师苏州桑泰海洋仪器研发有限责任公司,建筑
储备干部浙江聚诚商务有限公司龙泉分公司,人力资源
24届外观设计管培生（3dmax）佛山市优坐家具有限公司,室内装潢
单片机嵌入式软件工程师南京大石电子科技有限公司,电子技术
家庭教师深圳市觉知教育科技有限公司,教育培训
市场地推专员（漳州/泉州/龙岩/宁德）(J36150)新东方教育科技集团有限公司,教育培训
短视频运营专员藤县蜀大侠火锅店,媒体
研发专家恒申控股集团有限公司,研发
Java乐精灵教育科技（北京）有限公司,IT软件
【华忆芯】2024届嵌入式系统软件工程师浙江大华技术股份有限公司,电子技术
产品实习生上海洪朴信息科技有限公司,互联网
人力资源实习生-招聘&员工关系北京海天瑞声科技股份有限公司,人力资源
质量管理类（PV）浙江医药股份有限公司,医药
拓客顾问首账房商务服务（重庆）有限公司,房地产
社群运营实习生厦门吉比特网络技术股份有限公司,互联网
前端工程师（六险一金、弹性工作、大平台）广州凡岛网络科技有限公司,互联网
护理宁国市中医院,医疗保健
基金运营实习生上海殊馥投资管理有限公司,金融投资
策略产品实习生-国际化短视频北京抖音信息服务有限公司,媒体
研究助理勤合欣创(南京)私募基金管理有限公司,金融投资
写字楼租赁顾问北京金地智远房地产经纪有限公司,房地产
小初高学科教师杭州依米企业管理咨询有限公司,教育培训
质量管培生嘉宝莉化工集团股份有限公司,研发
新生力（生产管理方向）广东气派科技有限公司,加工制造
实习生（设计）欧诗漫生物股份有限公司,医疗设备
采购管培生北京云杉世界信息技术有限公司,物流运输
人资管培生-招聘方向（包食宿）陕西佳帮手集团控股有限公司,人力资源
软件工程师实习生苏州同元软控信息技术有限公司,IT软件
招聘实习生（双休+乙方性质）深圳市汇合发展有限公司,人力资源
语文教师（双休）四川东辰云校智能科技有限公司,教育培训
销售工程师（24届管培生）海能未来技术集团股份有限公司,物流运输
研发工程师国核电站运行服务技术有限公司,能源
京东（武汉）仓储作业员北京京东世纪贸易有限公司,物流运输
数据分析实习生（可留用）深圳市迪博企业风险管理技术有限公司,IT软件
国际会计岗神驰机电股份有限公司,金融投资
见习HRBP杭州实在智能科技有限公司,人力资源
项目助理/案场行助理/行政专员江苏搜好房网络信息科技有限公司,房地产
人事助理盐城彼岸教育咨询有限公司,人力资源
财务管理储备江苏贝尔家居科技股份有限公司,金融投资
试验二次连云港市港圣开关制造有限公司,加工制造
应急救援讲师中博宁（南京）安全科技有限公司,安全
销售专员内蒙古蒙龙种业科技有限公司,农业
代理商赋能-设计实习生行吟信息科技(上海)有限公司,广告
工艺工程师泰开集团有限公司,加工制造
韩语会计安波福（苏州）企业管理有限公司,金融投资
生产管理岗.联创电子科技股份有限公司,加工制造
运营实习生(可转正)四川鸿学金联科技集团有限公司,物流运输
新能源解决方案工程师西子清洁能源装备制造股份有限公司,新能源
产品经理实习生浙江大沩人工智能科技有限公司,IT软件
生产设备维护江苏邦能振键机械有限公司,加工制造
客户服务管培生丹阳谊善车灯设备制造有限公司,服务
储备干部上海浦东华油实业有限责任公司中油阳光大酒店,服务
景观施工图设计周末双休厦门市人才服务中心,建筑
巡检员南通先钶精密金属部件有限公司,加工制造
青岛京东方直招五险一金管吃管住青岛顺通达企业管理咨询有限公司,物流运输
hr实习生成都心田花开心语教育管理有限公司,人力资源
业务经理河南格瑞恩工业科技有限公司,服务
广告运营实习生-长沙（周末双休+五险一金）长沙幸可必格信息科技有限公司,广告
C/C++开发工程师中国电子科技集团公司第五十二研究所,IT软件
hrbp实习生杭州辛选网络科技有限公司,人力资源
算法工程师北京小蝇科技有限责任公司,IT软件
封装研发助理工程师江苏宏微科技股份有限公司,加工制造
视觉设计实习生(N8346)北京小米移动软件有限公司,媒体
数据建模实习生北京戴卡互娱科技有限公司,IT软件
人力资源实习生(招聘方向)歌尔股份有限公司,人力资源
系统架构工程师上海格物致远网络科技有限公司,IT软件
上位机软件工程师（工作地：北京）（沈阳）国芯科技,IT软件
hrbp实习生新东方教育科技集团有限公司,人力资源
医院检验助理南京道奇科技有限公司,医疗保健
中餐厅服务员江苏河海置业有限公司,餐饮娱乐
电商运营实习生网易（杭州）网络有限公司,互联网
品质助理工程师武汉云岭光电股份有限公司,加工制造
视觉设计实习生北京猿力未来科技有限公司,媒体
HR实习生浙江博锐生物制药有限公司,人力资源
质量管理员西双版纳久泰药业有限公司,医药
社群运营实习生（音乐方向）北京优贝在线网络科技有限公司,娱乐
金融经管专业实习可转正带薪休年假泰康人寿保险有限责任公司河北分公司,金融投资
产品工艺工程师浙江天际互感器股份有限公司,加工制造
实习岗位/望京SOHO工作北京丽兹行房地产顾问有限公司,房地产
临床医师滨海县中医院,医疗保健
电商产品上架专员山西阿理加都文化交流有限公司,互联网
测试开发实习生-商业产品与技术北京字跳网络技术有限公司,IT软件
【接受24届实习生】可线上面试/双人间宿舍大连金慧融智科技股份有限公司西安分公司,物流运输
外贸员欣灵电气股份有限公司,贸易
办公室助理北京车百会科技发展有限公司,服务
业务员东莞市创照灯具有限公司,批发零售
研究部MicroPET/MR中心江苏省原子医学研究所,医疗设备
嵌入式硬件工程师上海昌辉投资管理（集团）有限公司,IT硬件
逾期提醒客服青岛联信商务咨询有限公司长春分公司,服务
实习岗厦门市政智慧城市科技有限公司,IT软件
会计教师江西春华教育咨询有限公司,教育培训
智能机器人研发副主任专业师/专业师科学技术研究院,IT硬件
海外市场运营实习生-3D社交和创作平台深圳今日头条科技有限公司,媒体
2025实习-招聘顾问（北京）(J14148)北京北森云计算股份有限公司,IT软件
英文实习生广州易海创腾信息科技有限公司,媒体
项目经理助理江苏智仝建设科技有限公司,建筑
分析师助理（可留用）上海潮声广告有限公司,媒体
嵌入式硬件开发实习生深圳市绿康智能环保科技有限公司,IT硬件
人事助理/实习生乐活派（杭州）科技有限公司,人力资源
养殖生产管理储备干部牧原食品股份有限公司,农业
员工关系HR实习生珠海横琴启信商务服务有限公司,人力资源
编辑实习生杭州红花朵朵网络技术有限公司,媒体
高薪全职售前工程师重庆慈讯信息技术有限公司,IT硬件
