活动执行实习生重庆茶缘怡生健康科技有限公司,生活服务
电气工程师苏州佳祺仕科技股份有限公司,电子技术
传染病学中国人民解放军联勤保障部队第九四医院,医疗保健
运维顾问助理深圳市企企通科技有限公司,IT软件
指导员（平沙）广东博和利大数据服务有限公司,IT软件
采矿工程师驻马店乐润科技发展有限公司,采掘冶炼
软件开发岗中能建储能科技（武汉）有限公司,IT软件
助理工程师（上海）顺芯半导体2024,电子技术
创新行业经理中国联合网络通信有限公司浙江省分公司,互联网
Andriod开发工程师（英才班）无锡盈达聚力科技有限公司,IT软件
电容研发工程师（2024届应届生）胜业电气股份有限公司,电子技术
游戏测试武汉众娱信息技术有限公司,网络游戏
注册申报专员江苏宇田医药有限公司,医药
数据标注/ai训练师（太原）海南好思达网络科技有限公司,IT软件
大宗商品研究员山东渤海实业股份有限公司,金融投资
视频传媒南京派力广告实业有限公司,媒体
区域销售专员南京荣炬机电设备有限公司,批发零售
【上市大厂】招聘实习生郑州高途云集教育科技有限公司,教育培训
出纳云南志政教育科技发展有限公司,金融投资
综合办公室实习生（党建、宣传方向）贵州中建筑福物业管理有限公司,物业管理
计算机实验制作实习生上海卓越睿新数码科技股份有限公司,IT软件
数据分析北京达佳互联信息技术有限公司,IT软件
汽车销售顾问大理万福汽车销售服务有限公司凤仪分公司,汽车
长鑫（北京）2024NCG招聘简章长鑫集电（北京）存储技术有限公司,IT硬件
IT管培生（技术）广州凡岛网络科技有限公司,IT软件
电子电气员南京海员之家信息服务有限公司,电子技术
产品工程师天水华天传感器有限公司,电子技术
嵌入式开发实习生杭州海康威视数字技术股份有限公司,IT软件
设备储备干部泉州桃李面包有限公司,快消
甘肃民族师范学院2023年招聘公告北京心力志成科技有限公司,教育培训
研发助理工程师福建万安实业集团有限公司,加工制造
体育专任教师广东酒店管理职业技术学院,教育培训
实施工程师（含实习生）北京金云科技有限公司,IT软件
高中舞蹈教师（中国舞、拉丁舞方向）昭通市正道高级完全中学,教育培训
贷款客服经理中美联泰大都会人寿保险有限公司上海分公司,金融投资
包装部门实习生百威投资(中国)有限公司,快消
采购工程师牧原肉食品有限公司,批发零售
普通操作工亿华高新材料（南通）有限公司,加工制造
美容师-兴化上海唤昕妍生物科技有限公司,美容
营销管培生牧原食品股份有限公司,快消
测试开发工程师北京外企人力资源服务有限公司,IT软件
市场部营销助理实习生金信基金管理有限公司,金融投资
账号运营实习生（提供转正机会）杭州易联视界科技有限公司,互联网
沃尔玛亚马逊eBay电商运营厦门宝光兴网络科技有限公司,互联网
数字媒体教研实习生网易有道信息技术(北京)有限公司,IT软件
市场运营实习生（正式编+限会计专业）杭州光云科技股份有限公司,金融投资
高中政治教师廊坊华夏幸福学校,教育培训
技术型销售工程师-24届补录北京亚控科技发展有限公司,IT硬件
重症医学科医生苏州瑞华骨科医院,医疗保健
行政前台实习生武汉热玩科技有限公司,IT软件
心胸普通外科医师信阳一五四医院,医疗保健
软件架构师南京芯驰半导体有限公司,IT软件
成本会计长沙双胞胎饲料有限公司,会计审计
助理工程师南京京东方显示技术有限公司,电子技术
服装设计助理常熟市明道服饰商贸有限公司,服装
java实习生上海艾瑞市场咨询股份有限公司,IT软件
产品营销实习生深圳市创客工场科技有限公司,快消
生产管理徐州徐工挖掘机械有限公司,加工制造
大客户销售广东今日头条网络技术有限公司,互联网
美容师常州丰宛化妆品有限公司,美容
售后技术支持工程师北京蓝拓扑科技股份有限公司,IT硬件
CR24-SNYZ-养殖管培生（母猪场、育肥场、服务部）云南神农农业产业集团股份有限公司,农业
苑仕生-预结算方向广州华苑园林股份有限公司,房地产
环保工程师双胞胎(集团)股份有限公司,环保
青少素养教师（分级/启智/文学）西安市雁塔区新东方培训中心,教育培训
职能管理岗（人力资源、行政、党群、法务）中建七局第六建筑有限公司,中介服务
医药信息沟通专员山东福瑞达医药集团有限公司,医药
人力资源行政实习生安捷达(北京)顾问有限公司广州分公司,中介服务
客服专员-接受实习/双休成都大音希声科技有限公司,服务
大运营类（运营/工程/设计）青岛新城创置房地产有限公司,房地产
会计江苏振光电力设备制造有限公司,会计审计
抖音运营助理兼场控成都市笑脸科技有限公司,互联网
量化策略研究员上海宽投资产管理有限公司,金融投资
餐饮服务员佛山宾馆有限公司,餐饮娱乐
应届生福利【某音订单处理】河北博岳通信技术股份有限公司,电信运营
销售管培生千年舟新材科技集团股份有限公司,批发零售
统计员福建省大御卿科技有限公司,认证检验
市场储备干部摩顶新能源发展（云南）集团有限公司,新能源
店铺运营实习生完美世界（北京）软件科技发展有限公司,互联网
职能类管培生（战略行研、高管秘书、财务、物流采购、营销支持等）远东控股集团有限公司,金融投资
寒假工短期工兼职深圳富联富桂精密工业有限公司,加工制造
设计师北京电子工程总体研究所,教育培训
室内设计师重庆博立创信息科技有限公司,房地产
水资源论证报告编制河南双碳生态研究院有限公司,环保
企业客户销售运营实习生特斯拉汽车（北京）有限公司,汽车
中医科医生扬中市人民医院,医疗保健
生物、化学、化工英文学术期刊助理编辑曼迪匹艾（北京）科技服务有限公司,媒体
三维动画特效师弘业百成动漫科技（天津）有限公司,媒体
机械设计制造及其自动化、机电一体、数控类重庆市华翌智能装备有限公司,机械重工
视觉软件工程师佛山墨家科技有限公司,IT软件
财务实习生深圳市中手游网络科技有限公司,金融投资
管理类岗位中国航发沈阳黎明航空发动机有限责任公司,航天航空
设备工程师芯联集成电路制造股份有限公司,电子技术
组织文化部_文化落地与干部思想组实习生百度在线网络技术（北京）有限公司,媒体
实习研发工程师（农药行业）天津市汉邦植物保护剂有限责任公司,化工
基金运营实习生上海安放私募基金管理有限公司,金融投资
交互设计实习生：北京高德云图科技有限公司,IT软件
实验室技术员江苏帝奥微电子股份有限公司,电子技术
NS管培生（销售策划）中国平安人寿保险股份有限公司,保险
hr实习生-招聘行吟信息科技（上海）有限公司,人力资源
产品研发工程师日立建机（中国）有限公司,加工制造
市场推广满意付（武汉）科技有限公司,快消
法务实习生万宝盛华人力资源(中国)有限公司,法务
软件开发工程师瑞科技控股有限公司,IT软件
财务实习生（成都）孩子王儿童用品股份有限公司,快消
短视频koc达人苏州源祥文化传媒有限公司,媒体
研发助理工程师山东美多科技有限公司,工程
AIGC大模型架构研发工程师百度在线网络技术（北京）有限公司,IT软件
自动驾驶车辆动力学工程师（常熟）新新人力,汽车
战略实习生-国际化社区产品北京字跳网络技术有限公司,互联网
2024售前工程师福建顶点软件股份有限公司,IT软件
人力资源实习生武汉吉喵云科技有限公司,人力资源
工业炉设计北京航天迈未科技有限公司,工程
外贸销售员江苏腾旋科技股份有限公司,贸易
华东理工大学2023年秋季专门技术岗位招聘启事广州高才信息科技有限公司,教育培训
2024届-硕士-生物学研究员康龙化成（北京）新药技术股份有限公司,医药
设计实习生上海猎食客生物科技有限公司,医疗设备
营销管培生+包住宿+带薪培训南京考门医药科技有限公司,医药
招聘实习生（双休）龙泉工布数码科技有限公司,IT硬件
测试工程师江苏阿诗特能源科技有限公司,IT硬件
港航方向解决方案实习生百度在线网络技术(北京)有限公司,互联网
技术研发岗上海东方泵业（集团）有限公司,工程
项目主持人天津瑞普生物技术股份有限公司,医疗设备
售后客服宁波青年优品数字科技有限公司,家具家电
健身中心接待香格里拉大酒店（温州）有限公司,休闲度假
管培生南通科顺建筑新材料有限公司,物业管理
2024届校招岗-亚马逊运营（品牌甲方+双休）广东盈浩工艺制品有限公司,物流运输
医药代表江苏远恒药业有限公司,医药
项目市场营销策划推广经理助理贵州负氧安康房地产营销策划有限责任公司,房地产
erp实施顾问鼎捷软件股份有限公司,IT软件
昆明铁路局接待岗云南翔联航空服务有限责任公司,物流运输
数字化技术人员广东省交通规划设计研究院集团股份有限公司,IT硬件
招投标专员南京宝基输配电工程有限公司,物流运输
链家地产直聘置业顾问-底薪6000北京链家置地房地产经纪有限公司海淀八里庄路分公司,房地产
采购员（西安）欧圣电气2024,物流运输
课程顾问(J27214)新东方教育科技集团有限公司,教育培训
工艺工程师（2024届新生力）（陕西省）中国南玻集团股份有限公司,加工制造
悬挂装置修理工（工作地桂林）（广州）中国人民解放军第五七一八工厂,加工制造
博士后深圳市不动产评估中心（深圳市地质环境监测中心）,房地产
数字营销实习生（小红书直播）(A173008)上海目荻电子商务有限公司,互联网
水利规划人员广州市水务规划勘测设计研究院有限公司,水利
项目实施工程师帆软软件有限公司,IT软件
【唯家企业管理有限公司青岛分公司】V-star校招生唯家企业管理有限公司青岛分公司,人力资源
电话客服湖南洋格企业管理有限公司,客服
前台客服岗广州穗鹏体育文化有限公司,客服
嵌入式软件工程师（DSP）校招深圳市极测科技有限公司,IT软件
病理技术员南京普恩瑞生物科技有限公司,医疗保健
算法实习生深圳进化动力数码科技有限公司,IT软件
调试工程师江苏道同环境科技有限公司,工程
设备技术员安徽安纳达钛业股份有限公司,电子技术
软件测试实习生晶晨半导体科技（北京）有限公司,IT软件
龙湖集团HRBP实习生北京集顺工程咨询有限公司,人力资源
深化设计师助理长江精工（上海）建筑科技有限公司,室内装潢
web前端开发工程师中国民航信息网络股份有限公司,IT软件
应用工程师-扫描电镜方向国仪量子（合肥）技术有限公司,电子技术
金属材料工程师（广元）河南中孚实业,加工制造
审计岗中核汇能江苏能源有限公司,会计审计
数控技术员南通超达装备股份有限公司,加工制造
产品运营实习生安徽高灯微行科技有限公司,快消
模具设计/机械工程师黛杰汉金（沧州）精密模具有限公司,加工制造
管培生山东孔圣堂制药有限公司,医药
篮球课程顾问上海睿思体育发展有限公司南京分公司,休闲度假
管理培训生/管培生（佛山SPD项目）国药控股广东生物科技有限公司,医药
菁英计划（制造&amp;供应链）（党建）青岛啤酒股份有限公司,快消
销售经理成都兴中星石油技术有限公司,石油化工
奶吧人资储干浙江一鸣食品股份有限公司,快消
国际售后工程师美世乐（广东）新能源科技有限公司,新能源
实习生（储备市场营销岗）盛娱星汇文化传播有限公司,娱乐
CBD实习生行吟信息科技(上海)有限公司,互联网
客服主管助理上海易辟电子商务有限公司,客服
职能支持岗包住宿（工作地点在深圳）（昆明）大华深圳24,物流运输
游戏策划实习生心动网络股份有限公司,互联网
福建理工大学2023年师资招聘北京心力志成科技有限公司,教育培训
财务主管-拉萨中国铁路物资西安有限公司,物流运输
php开发实习生中教智网（北京）信息技术有限公司,IT软件
后端开发工程师北京沃东天骏信息技术有限公司,IT软件
iOS/Android开发工程师北京豪腾嘉科科技有限公司,IT软件
高中教师唐山市曹妃甸区贺阳高级中学有限责任公司,教育培训
市场实习生四川尚玖佳装饰工程有限公司,室内装潢
steam教研员师徒网（重庆）互联网服务有限公司,互联网
机械工程师浙江炜冈科技股份有限公司,机械重工
业务员上海易质谱科技有限公司,医疗设备
新能源技术工程师中复连众（连云港）风电叶片有限公司,新能源
设计管理工程师浙江华东工程建设管理有限公司,工程
财务管理专员贵州裕能新能源电池材料有限公司,新能源
审计专员浙江恒逸集团有限公司,会计审计
足球教练青岛坤羽体育俱乐部有限公司,休闲度假
抖音内容运营南京合斯满网络科技有限公司,媒体
机械设备维修山东嘉信新材料有限公司,机械重工
新媒体运营/直播场控-实习生上海哈普惠科技有限公司,媒体
运营工程师（材化类）英格尔检测技术服务（上海）有限公司,工程
招聘助理广州大事件网络科技有限公司,人力资源
光伏电池工艺助理工程师（盐城）新新人力,新能源
国际化专员扬子江药业集团有限公司,医药
实施工程师创业慧康科技股份有限公司,医疗设备
采购执行、采购助理、采购主管或实习生江苏梁缘建筑科技有限公司,采掘冶炼
内容审核（可接受24届同学，非销售）武汉佰钧成技术有限责任公司,媒体
java后端开发工程师杭州星临科技有限责任公司,IT软件
会计核算（库尔勒）中国电信集团,电信运营
教师东莞市步步高实验幼儿园,教育培训
【供住宿】社群运营实习生洪恩完美（北京）教育科技发展有限公司,教育培训
H206人工智能国家知识产权局专利局,IT软件
三维动画特效师长沙神漫文化科技有限公司,媒体
养殖岗实习生广州花都越秀农牧有限公司,农业
市场营销经理平阳县康恩儿童潜能发展中心,快消
礼宾员创威（常熟）置业有限公司康博国际大酒店,休闲度假
Python开发实习生作业帮教育科技（北京）有限公司,IT软件
董事长秘书(J21029)扬子江药业集团有限公司,医药
EHS工程师浙江森日有机硅材料有限公司,环保
产品设计岗光明,加工制造
拼多多-仓储管理管培生上海寻梦信息技术有限公司,物流运输
工艺工程师赛轮集团股份有限公司,加工制造
项目投资合伙人郑州白圭投后经济信息咨询有限公司,金融投资
技术员江苏泰力松新材料有限公司,电子技术
研发助理广东宏昊化工有限公司,化工
市场专员思才人力资源管理咨询（杭州）有限公司,咨询服务
运营柜员岗招商银行股份有限公司广州分行,金融投资
实习生（纯文职）国聘（山东）教育科技有限责任公司,教育培训
中小学语文教师、中学数学、历史、地理教师浙江省余姚市实验学校,教育培训
网优后台（接受无经验）西安长河通讯有限责任公司,电信运营
品牌设计实习生南极电商（上海）有限公司,媒体
信息流编导重庆浩玩信息科技有限公司,广告
工艺工程师江苏金桥油脂科技有限公司,加工制造
测试工程师光羿智能科技（苏州）有限公司,IT软件
包装平面设计师莆田市森品礼盒包装有限公司,包装
兴业银行博士后科研工作站2024年招收公告广州高才信息科技有限公司,金融投资
嵌入式软件开发工程师（工作地：苏州）（成都）国芯科技,IT硬件
后端开发实习生广州小嗨多多信息科技有限公司,IT软件
国际营销岗神驰机电股份有限公司,广告
西安草堂比亚迪7500元/月+社保包住比亚迪汽车工业有限公司,汽车
商品陈列专员陕西百峻贸易有限公司,批发零售
HR实习生招聘北京三快在线科技有限公司,人力资源
天然气分析化验技术岗中国石油化工股份有限公司天然气分公司,石油化工
路桥隧测量实习生四川金鑫工程测绘有限责任公司,土木工程
各学科老师（语/数/英/生/物/化/历/政/地）江门市百分教育投资有限公司,教育培训
精益助理工程师杭州杰牌传动科技有限公司,机械重工
软件开发工程师（应届正式岗位）华为技术有限公司,IT软件
银行大堂助理实习生（梅景支行）长沙惠邦网络科技有限公司,金融投资
效果图实习生云图数字视觉科技（杭州）有限公司,媒体
西班牙本地化武汉游戏群科技有限公司,互联网
运营管培生亚宝药业集团股份有限公司,快消
财务部实习生北京当当网信息技术有限公司,金融投资
销售经理牧原食品股份有限公司,快消
业务助理（英语方向）巨磊（嘉兴）精密部件股份有限公司,批发零售
客服专员安徽辉博会展有限公司,服务
网络工程师河南光华信息电子工程监理有限公司,电信运营
职能管理岗中建六局第五建设有限公司,建筑工程
设计实习生（电商方向）广州谷雨生物科技有限公司,服装
人才猎手厚成人力资源集团有限公司,人力资源
研发管培生杭州先途电子有限公司,IT硬件
机械电器岗新疆水利水电勘测设计研究院有限责任公司,机械重工
2024届应届生（其他类）锐拓（成都）国际文化艺术发展有限公司,休闲度假
人力资源实习生华测检测认证集团股份有限公司,人力资源
产品安全医生（厦门）厦门特宝生物工程股份有限公司,医疗保健
机修工贵州源锦水泥有限公司,加工制造
汽车电子测试工程师（长沙）新新人力,汽车
法务实习生上海鲜动信息技术有限公司,咨询服务
助理机械工程师常州赛乐医疗技术有限公司,医疗设备
HRBP实习生广州太平洋电脑信息咨询有限公司,人力资源
电商运营助理/实习生安徽酱樽商贸有限公司,互联网
质量工程师重庆创精温锻成型有限公司,加工制造
产品经理比亚迪汽车工业有限公司,汽车
商业写字楼选址顾问四川商诚一创洲际房地产经纪有限公司,房地产
用户运营实习生浙江踏云鞋业有限公司,服装
营销/策划/销售助理（实习岗可转正）北京泰达信通科技有限公司,金融投资
算法工程师盈峰环境科技股份有限公司,环保
霸王茶姬-维修支持实习生-成都(A208837)四川茶姬企业管理有限公司,快消
前台客服（实习+就业）广东全优加家庭服务科技有限公司,服务
设计马上消费金融股份有限公司,媒体
猎头顾问管培生-专注HR高管方向和力网职业顾问(北京)有限公司,人力资源
数据分析实习生北京万维之道信息技术有限公司,咨询服务
光伏系统设计中机国际工程设计研究院有限责任公司华东分院,新能源
算法工程师南京通达海科技股份有限公司,IT软件
机电、电气自动化管培生湖南大中赫锂矿有限责任公司,新能源
前端研发工程师-商业化技术北京字跳网络技术有限公司,IT软件
助理研发工程师浙江森日有机硅材料有限公司,化工
清洁生产审核师苏州锐诚环保技术有限公司,环保
行政实习生（哈尔滨）上海柏悦物业服务有限公司,物业管理
葡萄牙语翻译员中国能源建设集团广西水电工程局有限公司,石油化工
采购工程师牧原食品股份有限公司,快消
24届应用开发工程师北京亚控科技发展有限公司,IT软件
结构设计工程师国机数字科技有限公司,建筑工程
动漫设计安吉居然雅竹家居用品有限公司,家具家电
生产计划员昆明腾洋光学仪器有限公司,加工制造
HR实习生北京聚生缘网络科技有限公司,人力资源
客户执行实习生（整合营销方向）北京蓝色光标数字传媒科技有限公司,媒体
人力资源助理安若维他药业泰州有限公司,人力资源
hr实习生北京抖音信息服务有限公司,人力资源
财务实习生杭州橙财企业管理服务有限公司,金融投资
研发工程师大连医诺生物股份有限公司,医疗设备
新能源汽车电机开发工程师（蚌埠）新新人力,新能源
汽车质量工程师（蚌埠）新新人力,汽车
视频策划与剪辑-AI产品上海稀宇极智科技有限公司,媒体
系统运维实习生（杭州）北京直真科技股份有限公司上海分公司,IT软件
算法工程师东软集团南京有限公司,IT软件
器件测试工程师苏州珂晶达电子有限公司,电子技术
材料工程师上海名佳利金属有限公司,金属
ate测试开发工程师锐仕方达人力资源集团有限公司苏州园区分公司,IT软件
电商采购助理实习生广州盛道传媒科技股份有限公司,互联网
市场助理新文道考研教育科技（云南）有限公司,教育培训
餐饮洗碗保洁员湖南运达实业集团有限公司,餐饮娱乐
HOKA品牌电商市场实习生戴珂鞋业（上海）有限公司,服装
旅游定制师-宿迁南京途牛科技有限公司,休闲度假
会计新东方教育科技集团有限公司,会计审计
工程管理岗（北京及全国各地）北京市政建设集团有限责任公司,建筑设计
储备干部(J10791)日出东方,人力资源
广告优化实习生广东省广告集团股份有限公司,广告
2024届校园招聘（销售代表）华润医药集团有限公司,医药
艺术创管专员上海文广集团2024,媒体
篮球教练大姚飞人体育培训学校有限责任公司,体育
安环专员英科医疗科技股份有限公司,医疗保健
人力实习生（行政方向）润加物业服务（上海）有限公司,物业管理
爬虫工程师南京开为网络科技有限公司,IT软件
机械类专业教师南通市蓝领技工学校,教育培训
研发工程师纳峰新能源科技（上海）有限公司,新能源
文化运营专员德诚珠宝集团有限公司,文化传媒
电子工程师长沙全程数字机电科技有限公司,电子技术
比亚迪禅城店客服专员比亚迪汽车工业有限公司,汽车
大学教师北京心力志成科技有限公司,教育培训
中小学幼儿园教师扶绥县教育局,教育培训
华夏风物实习生北京值得买科技股份有限公司,互联网
检验员江苏洛克电气集团有限公司,认证检验
市场专员上海传梦实业（集团）有限公司,市场营销
财务管培生江苏三金锂电科技有限公司,金融投资
游戏开发工程师深圳市尚游网络科技有限公司,网络游戏
公众号运营实习生北京有道中一教育科技有限公司,互联网
韩语相关岗位乐星汽车电子（青岛）有限公司,汽车
法务实习生（涉外方向）广州九毛九餐饮连锁有限公司,法律
深度学习算法工程师实习生(J69393)百度在线网络技术（北京）有限公司,IT软件
重庆对外贸易学院国际交流合作处职员招聘公告北京千才汇信息技术有限公司,国际贸易
城市招商负责人黑岩网络科技（上海）有限公司,互联网
电商客服专员广州市海蓝茵子美容化妆品有限公司,电子商务
中集安瑞科2024届校招岗位中集安瑞科投资控股（深圳）有限公司,物流运输
120/天财务实习生（可开实习证明）年后到岗江苏苏南万科物业服务有限公司,会计审计
财务类管培生――2024届校招山东得益乳业股份有限公司,金融投资
主播常州微禾信息技术有限公司,媒体
海外流量优化师（24届春招）杭州哆啦咔科技有限公司,互联网
网络技术工程师(J10002)中国联通深圳市分公司,电信运营
乘务员舟山市旅游客车运输有限公司,交通运输
电子光学结构工程师国仪量子（合肥）技术有限公司,电子技术
外贸业务员安徽瑞程机械设备有限公司,国际贸易
质量管理岗（8-10K）生益电子股份有限公司,质量管理
铜箔研发类管培生远东控股集团有限公司,新能源
工程管理岗北京市政建设集团有限责任公司,建筑设计
计划财务岗（社会实践生)重庆小米消费金融有限公司,金融投资
销售工程师山东科汇电力自动化股份有限公司,销售
项目助理（林业规划）博雅达勘测规划设计集团有限公司,农业
家装电话销售曲靖如懿建筑装饰工程有限公司,室内装潢
销售工程师苏州市信测标准技术服务有限公司,销售
财务实习生（贵港）广西绿友农生物科技股份有限公司,会计审计
心血管内科临床医师北大医疗淄博医院有限公司,医疗保健
