企业,评分
华辰精密装备(昆山)股份有限公司,7209.171428571428
江苏宏鑫检测技术服务有限公司,287.1428571428571
徐州招盛酒店管理有限公司,58.42857142857143
大丰智慧(天津)医疗科技有限公司,145.0
江苏优普保鲜技术有限公司,0
江苏中厚网络科技有限公司,287.14285714285717
无锡微研精工科技有限公司,1432.5714285714284
淮安曙光国际大酒店有限公司,860.9999999999999
南京嘉成商务咨询有限公司,9.428571428571429
盐城人才金港教育科技有限公司,59.57142857142856
国信新能源科技(常州)有限公司,57.857142857142854
完美世界(北京)软件科技发展有限公司,289.42857142857144
湖南华易康健科技有限公司,572.8571428571429
普莱德汽车科技(苏州)有限公司,287.00000000000006
沛县兴蓉水务发展有限公司,21088.000000000004
南京华聚微波技术有限公司,57.857142857142854
中外运物流供应链管理(扬州)有限公司,7124.42437142857
江苏科诺牧业设备技术有限公司,885.2371428571428
江苏富瑞能源服务有限公司,1430.2857142857142
泰兴联创绝缘材料有限公司,450.1428571428571
江苏普莱克红梅色母料股份有限公司,1968.4999999999998
鑫车投资(上海)有限公司,58298.82971428571
哈尔滨众安锦禾企业管理咨询服务有限公司,86.99999999999999
中国外运股份有限公司,208411.625
包头市永盛成百货有限责任公司,1720.4285714285713
江苏阿拉丁留学咨询有限公司,287.1428571428571
江苏谷登工程机械装备有限公司,3431.428571428571
扬州苏榕驿信息咨询有限公司,14.999999999999998
常熟市鑫城贸易有限公司,289.14285714285717
南京利可生新材料有限公司,30.428571428571427
扬州蓝蜥蜴财务咨询有限公司,3.7142857142857135
大同新侨妇产医院有限公司,172.85714285714283
山西鼎朗文化传媒有限公司,30.0
苏州中轩古建园林工程有限公司,1482.5714285714284
北京吉云互动科技有限公司,32.14285714285714
江苏吾器酷体育产业有限公司,288.00000000000006
盐城市大丰区东方娃娃艺术培训有限公司,36.0
彩亭(南通)企业管理有限公司,144.14285714285714
江苏盈科生物制药有限公司,2195.2183428571425
天和国咨控股集团有限公司,1433.4285714285713
北京家嘉华洋科技发展有限公司,302.8571428571429
江苏志逸酒店管理有限公司,2858.428571428571
中国石油天然气股份有限公司吐哈油田分公司,5.857142857142857
南京新能极齿轮技术有限公司,1675.9371428571428
扬州珂尔信息科技有限公司,57.99999999999999
扬州大成文化用品有限公司,144.85714285714286
温州银行股份有限公司温州分行,3.4285714285714284
南京复宸置业有限公司栖霞酒店分公司,2.714285714285714
中材科技(邯郸)风电叶片有限公司,860.1428571428571
安徽轻龙新材料科技有限公司,287.5714285714286
增城市碧桂园物业发展有限公司,41382.0
奥力通起重机(江苏)有限公司,3429.7142857142853
益海嘉里(北京)粮油食品工业有限公司,5889.142857142857
天津紫龙奇点互动娱乐有限公司,232.37502857142854
江苏朴澄智慧科技有限公司,287.0
深圳市现代豪方仪器仪表科技有限公司,31.71428571428571
江苏专创轻合金科技有限公司,287.2857142857143
浙江严牌过滤技术股份有限公司,5855.257142857144
苏州欧瑞教育科技发展有限公司,373.99999999999994
常州艾龙森汽车饰件有限公司,575.0
南京锦上雅集餐饮管理有限公司,288.5714285714286
大连信融知识产权服务有限公司,29.285714285714285
杭州多泰科技有限公司,87.85714285714285
深圳市优求网络科技有限公司,144.14285714285717
富誉电子科技(淮安)有限公司,8610.571428571428
申华化学工业有限公司,1182.8571428571427
太仓市知一文化创意有限公司,29.57142857142857
南通极兔供应链管理有限公司,29.714285714285715
上海国民实业集团粮油有限公司,288.8571428571429
江苏大生电气工程有限公司,1147.7142857142858
光卓新材料(江苏)有限公司,2859.0
江苏奥迈生物科技有限公司,717.2857142857142
豪迪微电子(深圳)有限公司,468.94897142857144
温州钛稷贸易有限公司,83.42857142857142
常熟东南塑料有限公司,1005.2857142857142
江苏东交智控科技集团股份有限公司,1171.6993714285716
南京陆加壹智能科技有限公司,1431.4285714285713
厦门易兴康生物科技有限公司,145.71428571428572
爱维尔(苏州)食品有限公司,181.85714285714286
通力电梯有限公司南京分公司,6.142857142857142
无锡智笼餐饮服务有限公司,58.28571428571428
宏全企业(苏州)有限公司,766.4285714285713
中山证券有限责任公司南京分公司,3.142857142857143
江苏天元智能装备股份有限公司,6129.954285714285
南京艾普锐得网络科技有限公司,29.857142857142858
中铁物资集团华南有限公司,8576.0
南京市测绘勘察研究院股份有限公司,4167.0
翰博高新材料(合肥)股份有限公司,5331.142857142857
日立安斯泰莫动力系统(南京)有限公司,3487.571428571428
江苏金色农业股份有限公司,2860.5714285714284
南通新帝克单丝科技股份有限公司,686.1785428571427
南通中远海运重工装备有限公司,1674.4942857142853
重庆民意家具制造有限公司,1447.2857142857142
上海中电电子系统科技股份有限公司,1438.142857142857
深圳未来脑律科技有限公司,34.75999999999999
广东省医药集团有限公司,4862.285714285714
江苏鲁汶仪器股份有限公司,4264.571428571428
南京亿文物业管理有限责任公司,1435.2857142857142
盛虹集团有限公司,21276.16857142857
四川恒创特种纤维有限公司,347.7142857142857
汉摩尼(江苏)光电科技有限公司,1659.0
海光信息技术股份有限公司,66413.37402857142
农芯科技(北京)有限责任公司,403.0
国药数字科技(北京)有限公司,2288.1428571428573
靖江市机器人智能制造有限公司,4287.714285714285
中安锐达(南京)电子科技有限公司,30.0
华谊影城(苏州)有限公司,30001.28571428571
江苏科德新材料有限公司,572.7142857142857
南京中电熊猫磁电科技有限公司,1717.5714285714284
苏州东吴热电有限公司,4369.285714285714
路易达孚(张家港)饲料蛋白有限公司,1145.0
无锡市同翔科技有限公司,160.85714285714286
南通市海门区宏日艺术培训有限公司,15.714285714285714
北京阅享网络科技有限公司,858.7142857142857
北京畅哲科技有限公司,270.42857142857144
上海先祥医药科技有限公司,287.7142857142857
宿迁市水务勘测设计研究有限公司,347.2857142857143
江苏慈星医药科技股份有限公司,1430.1428571428569
南京惠诚工具制造有限公司,289.7142857142857
淮安金陵大酒店有限公司,5681.3409142857145
江苏森博新材料有限公司,4287.999999999999
南京汪海混凝土有限公司,860.5714285714286
宝银特种钢管有限公司,27224.051428571427
山东华云三维科技有限公司,1430.4285714285713
江苏数丰水产种业有限公司,345.7142857142857
绵阳京东方光电科技有限公司,742860.5714285714
长沙康嘉宁科技有限公司,15.285714285714285
嘉事国润(上海)医疗科技有限公司,860.2857142857142
中核机械工程有限公司,6289.428571428572
同道精英(天津)信息技术有限公司广州分公司,3.2857142857142856
苏州中材建设有限公司,1436.2857142857142
科笛生物医药(无锡)有限公司,28573.142857142855
兰州电力修造有限公司,3641.0
中国核工业集团有限公司,1700005.857142857
无锡市前洲建设工程有限公司,1004.2857142857142
南京屈臣氏个人用品商店有限公司,1530.1428571428569
无锡海拓环保装备科技有限公司,860.2857142857142
苏州英途康医疗科技有限公司,1509.4935142857141
启星数智科技(徐州)有限公司,287.14285714285717
江苏珠合新能源科技有限公司,287.0
永旺华东(苏州)商业有限公司,15289.0
南京瑞霞明州康复医院有限公司,1716.0
南京怡享康教电子科技有限公司,58.71428571428571
广东德石实业控股有限公司,144.14285714285714
芜湖市外经服务有限公司,175.85714285714283
东方盐湖城旅游发展有限公司,20346.999999999996
江苏福宸优采网络科技有限公司,287.42857142857144
深圳市中燃科技有限公司,574.8571428571428
连云港金奥教育培训集团有限公司,145.0
璋全五金制品(昆山)有限公司,599.9197714285713
无锡航天江南数据系统科技有限公司,287.8571428571429
湖南景翰教育管理有限责任公司,287.00000000000006
上海颉盈文化传媒有限公司,173.71428571428572
北京神州泰岳软件股份有限公司,56036.770971428574
杭州乐橙品牌管理有限公司,145.28571428571428
鲸彩互联科技(广州)有限公司,1.1428571428571428
南京沪江复合材料股份有限公司,2078.116428571429
扬州晨化新材料股份有限公司,6087.525142857142
江阴市鸿萌橡塑制品有限公司,1918.7371428571428
常州朗琢教育科技有限公司,15.285714285714285
江苏易飞文化传播有限公司,287.28571428571433
财通证券资产管理有限公司,5716.857142857142
晶科能源股份有限公司,285719.14285714284
陕西凤凰国际飞行学院有限责任公司,1223.9228571428569
深圳TCL数字技术有限公司,2860.9999999999995
西域智慧供应链(上海)股份公司,13437.254085714285
富盛科技股份有限公司,1656.4285714285713
江苏永续动力科技有限公司,287.7142857142857
苏州伟中蔚蓝智慧科技有限公司,86.99999999999999
贵州林东矿业集团有限责任公司,9206.714285714284
上海斯选网络科技有限公司,144.42857142857144
沃尔玛(厦门)商业零售有限公司厦门自贸试验区山姆会员分店,3.4285714285714284
北京香侬慧语科技有限责任公司,573.5714285714286
南京昌德成电器有限公司,803.5714285714286
淮安欣展高分子科技有限公司,146.0
杭州微纳科技股份有限公司,498.57142857142856
中机锻压江苏股份有限公司,916.7142857142857
苏州近悦商贸有限公司,87.71428571428571
无锡市道普威控制索有限公司,288.14285714285717
江苏华海汽车销售集团有限公司,1435.1428571428569
江苏徐矿综合利用发电有限公司,16003.571428571428
常州市常能电力工程咨询有限公司,345.85714285714283
江阴嘉鸿橡塑科技有限公司,1717.142857142857
南京金陵石化工程监理有限公司,291.00000000000006
常州市顺祥新材料科技股份有限公司,1320.7754285714284
沃沛斯(常州)能源科技有限公司,288.5714285714286
江苏云之遥信息科技有限公司,287.8571428571429
江苏双良新能源装备有限公司,3432.714285714286
山东凤凰新材料科技有限公司,2859.0
上海峰唯峰网络科技有限公司,58.14285714285714
天津链家宝业房地产经纪有限公司,290.42857142857144
合肥正阳光电科技有限责任公司,968.4285714285713
江南信安(北京)科技有限公司,2155.2857142857147
江苏云锦家纺有限公司,1716.0
昆山博益鑫成高分子材料有限公司,1574.9999999999998
苏州立禾生物医学工程有限公司,926.824257142857
江苏欣云昌电气科技有限公司,859.4285714285713
江苏康达检测技术股份有限公司,1539.1714285714286
杭州千岛湖润和度假村有限公司千岛湖伊敦度假酒店,4.142857142857142
苏州松谷智能装备股份有限公司,573.5714285714286
南京埃尔乔亿自控设备有限公司,288.7142857142857
国海富兰克林基金管理有限公司,6290.285714285714
北京云万维数据技术有限公司,287.57142857142856
上海摩尔口腔医院管理集团股份公司,2450.4495428571427
武汉格木教育科技有限公司,31.0
四川明德瑞信税务师事务所有限公司,30.428571428571427
倍威实业(嘉兴)有限公司,118.42857142857142
东杰智能科技(江苏)有限公司,1430.5714285714284
上海澈芯科技有限公司,58.14285714285714
浙江创豪半导体有限公司,6431.142857142858
星光智造家智能科技(苏州)有限公司,145.0
无锡市迪赛环境艺术设计事务所,12.142857142857142
苏州瑞诺盟新能源电机有限公司,145.0
北京赛赋医药研究院有限公司,179.80785714285713
南京乐康食品有限公司,29.857142857142858
上海不咕不咕文化传媒有限公司,16.142857142857142
山西中勤正和会计师事务所有限公司,34.57142857142857
宁波睿读文化艺术有限公司,29.857142857142858
扬州市胜友进出口有限公司,30.428571428571427
钟祥亿米装饰设计工程有限公司,58.42857142857142
连卡佛百货商贸(北京)有限公司,1147.0
上海玖钲机械设备有限公司,320.0
淮南市天顺食品科技有限公司,82.0
江苏熙和医疗科技有限公司,858.5714285714286
中信证券股份有限公司宁波北仑新碶证券营业部,4.285714285714286
上海菏明国际贸易有限公司,8573.999999999998
深圳市智莱科技股份有限公司,6863.0
北京华光浩阳科技有限公司,3147.8571428571427
福建金创利信息科技发展股份有限公司,1431.5714285714284
南京红星旅游发展有限公司,288.00000000000006
江苏文者登高教育科技有限公司,287.7142857142857
浙江正和流体科技股份有限公司,1074.8571428571427
上海久谦化工有限公司,32.14285714285714
绍兴上虞大康体育健身设施制造有限公司,1718.5714285714284
融华国际物流(宁波)有限公司,143.85714285714286
上海赋猎企业管理咨询有限公司,30.0
恒泰长财证券有限责任公司,5719.142857142856
嘉吉投资(中国)有限公司,18763.01217142857
南京英格玛仪器技术有限公司,576.5714285714286
索普瑞玛(上海)建材贸易有限公司,146.42857142857142
上海电气(江苏)综合能源服务有限公司,1403.4285714285713
珍奥集团股份有限公司,2864.8571428571427
浙江地标设计集团有限公司,1432.857142857143
宁波铭瑞中兴电子科技有限公司,30.857142857142854
深圳前海盈余科技有限公司,287.57142857142856
杭州信雅达三佳系统工程股份有限公司,432.7142857142857
苏州康弗士科技有限公司,146.14285714285714
上海耀康国际贸易有限公司,289.42857142857144
苏州以利亚智能科技有限公司,287.7142857142857
常州西玛特电器有限公司,39.285714285714285
浙江御安信息技术有限公司,635.232857142857
深圳市收收科技有限公司,287.42857142857144
正业勘测设计集团有限公司,1862.5714285714284
青岛泰凯英专用轮胎股份有限公司,5060.714285714285
上海圣医健康管理咨询有限公司,16.142857142857142
江苏友康生态科技有限公司,788.9921428571427
江苏西石沟农业开发有限公司,637.342857142857
宁波凯星通教育科技有限公司,146.8095142857143
上海苏科建筑技术发展有限公司,1432.8571428571427
南通科迅教育信息咨询有限公司,3.428571428571428
南京保利大剧院管理有限公司,88.28571428571428
颍上县鑫尚木业有限公司,858.1428571428571
河南艾致森家居有限公司,29.57142857142857
江苏命码生物科技有限公司,652.8828571428572
北京昆兰新能源技术有限公司,1486.8016285714284
石家庄锦鸿能源科技有限公司,302.8571428571429
北京京昌工程测绘技术有限公司,290.5714285714286
河北么税企业管理有限公司秦皇岛分公司,2.714285714285714
绿都智慧生活服务有限公司,1429.5714285714284
昆山协鑫蓝天分布式能源有限公司,8630.999999999998
苏州济丰寰亚信息技术有限公司,288.85714285714283
常州市乐萌压力容器有限公司,4004.714285714286
浙江品素服饰有限公司,288.14285714285717
广州思帆信息科技有限公司,11.142857142857142
浙江源生影视文化有限公司,287.1428571428571
江苏洛柳精密科技有限公司,716.5714285714284
厦门兴宏星装饰设计工程有限公司,600.7142857142857
苏州中恒普瑞能源互联网科技有限公司,1431.9999999999998
江苏伟伦运动休闲用品有限公司,2288.714285714286
南通瑞慈医院有限公司,1948.5714285714282
中企企祥(苏州)科技有限公司,145.57142857142856
苏州德高进出口有限公司,576.1428571428572
上海司南卫星导航技术股份有限公司,1779.4285714285716
陕西千寻千遇信息科技有限公司,29.285714285714285
金能化学(青岛)有限公司,285717.4285714286
无锡梦想海天教育科技有限公司,145.14285714285714
史丹利农业集团股份有限公司,33059.82857142857
湖南迪诺制药股份有限公司,516.8874000000001
东莞市金永鑫精密科技有限公司,288.14285714285717
石河子市凌界影视文化传播有限公司,58.28571428571428
新疆拓南供应链管理有限公司,144.28571428571428
南京吴门华韵文化艺术发展有限公司,15.285714285714285
苏州迈之文化传媒科技有限公司,287.14285714285717
无锡尖峰时刻体育文化有限公司无锡锡东分公司,2.4285714285714284
上海游之趣网络科技有限公司,144.28571428571428
上海佩企信息技术有限公司,2859.142857142857
南通鑫厚精密科技有限公司,287.0
南通市聚仁人力资源有限公司,346.57142857142856
山东元牧教育信息科技有限公司,87.99999999999999
南通沪崇电子商务有限公司,287.14285714285717
尚层装饰(北京)有限公司无锡分公司,2.8571428571428568
南京银雁支付技术服务有限公司,146.0
太仓市一鼎文化传媒有限公司,4.7142857142857135
天津环球磁卡集团有限公司,69718.71428571428
烟台之星汽车服务有限公司,1032.4285714285713
上海必过教育科技有限公司,15.285714285714285
上海联畅房地产经纪有限公司,144.42857142857144
中建六局(天津)绿色建筑科技有限公司,1432.9999999999998
河南创赛通信科技有限公司,288.0
深圳市宝泰建设实业有限公司,601.8228571428572
广东联富建设工程有限公司,6232.857142857142
上海中建东孚物业管理有限公司南京分公司,3.4285714285714284
江苏常青树新材料科技股份有限公司,5505.142857142857
阿特斯阳光电力集团股份有限公司,105382.06639999998
江阴市公本教育咨询有限公司,6.428571428571428
毅联实业(上海)有限公司,573.5714285714286
江阴市汉和文化传播有限公司,33.57142857142857
金东纸业(江苏)股份有限公司,464616.90631428576
南京商贸旅游股份有限公司,8880.967971428572
浙江理工大学桐乡研究院有限公司,16.285714285714285
江苏周黑鸭食品工业园有限公司,8574.285714285714
浙江鑫亚控股集团有限公司钱江新城万怡酒店分公司,3.8571428571428568
江苏光辉电力器材有限公司,592.7142857142857
藏格矿业股份有限公司,45161.573514285716
广东伊丽汇美容科技有限公司,1859.4285714285713
镇江首创创宜环境科技有限公司,831.6057142857142
堀场(中国)贸易有限公司,342.2857142857142
河北协同水处理技术有限公司,1545.5714285714284
金光纸业(中国)投资有限公司,153720.14285714284
苏州铜盟电气有限公司,2860.714285714286
广州佑佑巴士贸易有限公司,15.142857142857142
北京达美国际旅行社有限责任公司,288.7142857142857
中电建(丽水)规划勘测设计研究院有限公司,859.1428571428571
温州语桐科技有限公司,16.285714285714285
上海乐道物业管理有限公司,860.5714285714284
深圳市成为信息股份有限公司,1705.1057142857144
南京宇晟健康管理有限公司,30.0
无锡市河埒传感器有限公司,345.48571428571427
常熟市善泳体育文化产业有限公司,14.999999999999998
拜瑞食品江苏有限公司,431.0
上海瓴雁投资管理有限公司,288.14285714285717
赛瓦软件(上海)有限公司,861.1428571428571
上海典世企业管理咨询有限公司,73.28571428571428
大华会计师事务所(特殊普通合伙),774.8571428571427
江苏昕感科技有限责任公司,5716.857142857143
上会会计师事务所(特殊普通合伙)山西分所,3.714285714285714
青岛福瑞安贸易有限公司,29.714285714285715
广州咪哆时代文化艺术传媒有限公司,4.285714285714285
大连瀚闻资讯有限公司,289.7142857142857
神州数码系统集成服务有限公司,22861.714285714283
常州一二三法律咨询服务有限公司,287.00000000000006
金丰(江苏)机械工业有限公司,965.8571428571428
苏州晶方半导体科技股份有限公司,18650.577885714283
湖北省成套招标股份有限公司,1805.142857142857
成都猫眼石网络科技有限公司,31.14285714285714
郑州沧溟教育咨询有限公司,15.142857142857142
深圳无域科技技术有限公司,2858.8571428571427
上海爱生特商用物业管理有限公司,147.42857142857144
北京全科在线科技有限责任公司,289.14285714285717
南京中旭电子科技有限公司,290.42857142857144
江苏伍星动力科技有限公司,287.7142857142857
南通佛力家纺有限公司,29.857142857142858
北京润健京康医院管理有限公司,743.8571428571428
昆山祈心信息科技有限公司,15.57142857142857
阜宁县城市发展投资集团有限公司,85718.28571428571
杭州时代银通软件股份有限公司,1273.4285714285713
湖北优橙科技有限公司,30.0
乐山希尔电子股份有限公司,1869.9999999999998
南京乐威贸易有限公司,29.714285714285715
上海伟诺信息科技有限公司,29.857142857142858
南京竹松钢铁贸易有限公司,143.85714285714286
江苏欣力元生物制药有限公司,572.8571428571429
江苏京源环保股份有限公司,4325.111399999999
香洋新材料(江苏)有限公司,1430.8571428571427
升辉新材料股份有限公司,4719.428571428572
宜兴华谊一品着色科技有限公司,3432.0
腾讯云雀(天津)信息技术有限公司,1431.285714285714
河北沐让新能源科技有限公司,286.7142857142857
中诚信泰(山东)信息有限公司,86.99999999999999
江苏永高钢丝制品有限公司,627.4285714285713
江苏聚硕智能科技有限公司,287.7142857142857
苏州康启环境科技有限公司,115.57142857142856
江苏乐世食品有限公司,2001.0
诚创智能科技(江苏)有限公司,915.2857142857142
徐州重型机械有限公司,34292.142857142855
深圳乐益施生态科技有限公司,229.85714285714286
石家庄市鑫宇智能衡器有限公司,89.57142857142856
广州骏伯网络科技有限公司,700.5410571428571
上海斐亨家具销售有限公司,29.857142857142858
上海沃能实业有限公司,31.857142857142854
碧兴物联科技(深圳)股份有限公司,2246.825714285714
厦门嘉盛生物科技有限公司,130.7142857142857
泰州市宝泽汽车销售服务有限公司,174.28571428571428
昆山信安信息科技有限公司,17.57142857142857
无锡理奇智能装备股份有限公司,3084.8571428571427
三浦工业(中国)有限公司,1579.527142857143
北京礼信年年餐饮管理有限公司,2860.8571428571427
上海绿地酒店旅游(集团)有限公司荆州绿地铂骊酒店,3.571428571428571
山东福慧生物科技有限公司,87.71428571428571
河北伯润信息科技有限公司,145.28571428571428
扬州上建混凝土有限公司,716.142857142857
盐城市艾美莉整形美容医院有限公司,89.14285714285712
创想智控科技(南京)有限公司,29.285714285714285
上海太懿教育科技有限公司,30.142857142857142
南通市谷溢新农业科技有限公司,143.85714285714286
江苏汉盛海洋装备技术有限公司,1203.2857142857142
国泰君安证券股份有限公司淮安淮海东路证券营业部,3.571428571428571
苏州辰瓴光学有限公司,1716.2857142857142
天津新荣信息技术有限公司,29.285714285714285
智慧芽信息科技(苏州)有限公司,15289.999999999998
幂聚科技(北京)有限公司,4.571428571428571
纪元数科(北京)技术有限公司,163.6233714285714
武汉市诺瓦文化传媒有限公司,29.57142857142857
安徽兴中会计师事务所(普通合伙),144.2857142857143
北京君伯兴酉科技发展有限公司,15.428571428571427
北京悦汀象果文化传媒有限公司,1.0
光轮智能(北京)科技有限公司,49.60545714285714
律胜科技(苏州)有限公司,460.71428571428567
淮安锦韵文化传媒有限公司,30.142857142857142
江苏集萃工业生物技术研究所有限公司,287.7142857142857
江苏约客企业服务有限公司,288.14285714285717
世茂天成物业服务集团有限公司第六分公司,4.428571428571429
新能动力(无锡)电气科技有限公司,287.42857142857144
北京昭衍新药研究中心股份有限公司,10898.756914285714
江苏科标医学技术集团有限公司,460.55931428571427
南京明基医院有限公司,5491.428114285714
江苏新华日报资产管理有限公司,2858.8571428571427
热爱之光(上海)钻石有限公司,286.7142857142857
恒筑伟业信息咨询(北京)有限公司,1430.4285714285713
广州穗鹏体育文化有限公司,3.5714285714285707
汇昕辰(重庆)文化传媒有限公司,29.285714285714285
上海耶古网络信息科技有限公司,144.14285714285717
昌宁双胞胎饲料有限公司,87.14285714285714
南京边城体育用品股份有限公司,2319.1849428571427
苏州太仓宝龙大酒店有限公司太仓宝龙福朋酒店,4.285714285714286
江苏锡华智能装备有限公司,572.4285714285714
苏州朗威电子机械股份有限公司,3901.428571428571
用友网络科技股份有限公司无锡分公司,5.571428571428571
鸿宇金柯(天津)科技集团有限公司,1429.857142857143
西数服(西安)科技有限公司,29.285714285714285
珠海学为贵教育咨询有限公司,30.14285714285714
绵阳市北牧星科技有限公司,2.142857142857143
苏州马尔萨斯文化传媒有限公司,287.57142857142856
海明(江苏)环境科技有限公司,860.5714285714286
深圳市金地物业管理有限公司,5721.0
苏州莱恩精工合金股份有限公司,1467.5723714285714
江苏恒鑫润翔机电制造有限公司,289.7142857142857
苏州慕名信息技术有限公司,60.285714285714285
