企业,评分
滦州伊利乳业有限责任公司,10575.571428571428
涿州衡启通讯技术开发有限公司牡丹江分公司,2.714285714285714
郑州诚信志远果业(集团)有限公司,288.28571428571433
惠州江科光电有限公司,430.2857142857143
兴业银行股份有限公司信用卡中心,4.571428571428571
中铁置业集团上海投资发展有限公司,14288.285714285712
江苏润阳新能源科技股份有限公司,10289.571428571428
深圳美大网络科技有限公司,39.523799999999994
沁航(陕西)文化传媒有限公司,57.857142857142854
南京淘赏网络科技有限公司,288.14285714285717
南京瑞电自动化科技有限公司,859.8571428571428
鹰普(中国)有限公司,2915.0
南京磁谷科技股份有限公司,2040.317142857143
苏州恒信建设技术开发检测有限公司,304.0
佛山尊贤行控股集团有限公司,2859.142857142857
深圳精智达技术股份有限公司,2689.6215428571427
石溪信息科技(上海)有限公司,288.00000000000006
深圳市华翰鸿运国际物流技术有限公司,859.7142857142857
杭州大头网络科技有限公司,33.714285714285715
广东商讯科技有限公司,287.1428571428571
苏州桑泰海洋仪器研发有限责任公司,1003.2857142857142
利民化学有限责任公司,2860.142857142857
苏州伟创电气科技股份有限公司,6011.264971428572
广州众山精密科技有限公司,2708.876171428571
广西中煤地质有限责任公司,3435.285714285714
中建六局水利水电建设集团有限公司,3316.0
四川康利包装股份有限公司,1718.4285714285713
沈阳博泰生物制药有限公司,276.7252857142857
宁波海尔施基因科技股份有限公司,1064.4705999999999
中企云链股份有限公司,11032.142857142855
广州南岗万达广场商业运营管理有限公司,30.14285714285714
浙江爱客智能科技有限责任公司,859.2857142857142
湛江市戴维斯商业管理有限公司,573.2857142857142
漯河柔甲信息科技有限公司,14.999999999999998
北京亿华通科技股份有限公司,4731.593485714286
无锡理奇智能装备有限公司,3084.8571428571427
河北汉光重工有限责任公司,10845.714285714286
北京海量数据技术股份有限公司,8093.999714285715
中移(上海)信息通信科技有限公司,57146.0
鑫荣懋果业科技集团股份有限公司,11605.285714285714
江阴市博汇机械成套设备有限公司,3718.1428571428573
海保人寿保险股份有限公司,42859.71428571428
山东德环检测技术有限公司,145.28571428571428
盐城市东港药物化工发展有限公司,432.7142857142857
浙江奥新仪表有限公司,3948.285714285714
莱茵优品(北京)科技有限公司,230.85714285714283
南京蓝鲸人网络科技有限公司,58.885485714285714
杭州安可茂贸易有限公司,15.285714285714285
上海雪山之巅信息技术有限公司,29.714285714285715
广州市景心科技股份有限公司,1823.097142857143
智山大纳(广州)服饰有限公司,2.1428571428571423
四川舒凡企业管理咨询服务有限公司,287.28571428571433
湖北君行建设有限公司,58.14285714285714
江苏剑牌农化股份有限公司,5362.142857142857
湖北西江石建设有限公司,287.57142857142856
青岛兴亚国际海事服务有限公司,176.14285714285714
阳光雨露信息技术服务(北京)有限公司南京服务中心,5.285714285714286
上海孝庸私募基金管理有限公司,859.4285714285713
河北省众联能源环保科技有限公司,1547.2857142857142
青海泰丰先行锂能科技有限公司,21210.114199999996
贵阳兔牙网络科技有限公司,29.285714285714285
浙江中鼎纺织股份有限公司,3605.0
富士康精密电子(太原)有限公司,13533.42857142857
雨果博斯(上海)商贸有限公司,227.7142857142857
四川云景文化传播有限公司,144.14285714285717
常州回天新材料有限公司,7145.857142857142
南京新东方文化艺术发展有限公司,58.714285714285715
中国平安人寿保险股份有限公司陕西分公司,5.285714285714286
深圳市康哲药业有限公司,10007.857142857143
安徽森泰木塑集团股份有限公司,3381.9999999999995
广州汇登信息科技有限公司,295.0529428571429
深圳市燕麦科技股份有限公司,4141.9581714285705
华海智汇技术有限公司,6829.920000000001
江苏金斯瑞生物科技有限公司,3517.714285714286
中信证券股份有限公司深圳分公司,6.428571428571428
天翼电子商务有限公司,22142.630885714283
北京旷视科技有限公司,2861.2857142857138
浙江亚特电器股份有限公司,9040.914514285714
百纳互动网络(福建)有限公司,288.0
福建凤竹纺织科技股份有限公司,7778.428571428571
逸超科技(北京)有限公司,441.96042857142857
北京士模微电子有限责任公司,69.20928571428571
成都络秋风商务服务有限公司,15.428571428571427
杭州神采飞扬娱乐有限公司,289.7142857142857
广东水冠环境科技有限公司,172.14285714285717
中建七局国际工程建设有限公司,5718.571428571428
中国石油化工股份有限公司天然气分公司,5.0
日邮物流(中国)有限公司,563.3588285714285
湖南长银五八消费金融股份有限公司,25716.714285714286
扬州市环球雅思文化交流有限公司,17.142857142857142
无限光年(上海)技术有限公司,2573.9999999999995
深圳市言羽科技有限公司,143.85714285714286
海信集团有限公司,23040.42857142857
杭州蚁修网络技术有限公司,52.85714285714285
杭州大掌贵家居有限公司,83.85714285714285
优贲企业服务(上海)有限公司,30.285714285714285
江西华夏教育科技有限公司,57.99999999999999
中国建设银行股份有限公司青岛市分行,7.7142857142857135
埃地沃兹真空泵制造(青岛)有限公司,386.2857142857143
广东睿住智能科技有限公司,1432.1428571428569
深圳思为科技有限公司,215.9200285714286
辰欣药业股份有限公司,12942.432257142857
湖南湘科控股集团有限公司,85717.28571428571
广州佳美展览有限公司,433.0
深圳市亚声威格科技有限公司,292.57142857142856
上海跬智信息技术有限公司,288.00000000000006
山东华置伟业集团有限公司,858.2857142857142
上海卓越睿新数码科技股份有限公司,1717.7142857142856
北京恺望数据科技有限公司,439.54
中粮可口可乐饮料(中国)投资有限公司,3147.714285714286
河南九芒珠网络科技有限公司,58.42857142857142
中广核铀业发展有限公司,294253.8458857143
嘉兴沪嘉环境服务有限公司,144.85714285714286
北京寿山福海投资发展集团有限公司,3430.8571428571427
奥士康科技股份有限公司,9072.014399999998
中国水利水电第七工程局有限公司,100006.85714285714
厦门建发集团有限公司,257148.57142857142
上海银浆科技有限公司,872.8571428571428
宁波桓昱电子商务有限公司,30.142857142857142
苏州艾川森五金制品有限公司,29.57142857142857
深圳亿维智形科技有限公司,144.71428571428572
易丞(北京)信息服务有限公司,1430.1428571428569
双登集团股份有限公司,10240.4
南京易威乐自动化技术有限公司,145.0
日照市澳思柏恩装饰材料有限公司,6573.714285714284
珠海华冠科技股份有限公司,1290.7142857142856
江苏北星新材料科技有限公司,17145.714285714286
广德惠民医院有限公司,2145.0
科邻新能源(合肥)有限责任公司,167.66128571428567
安徽戎志之智科技有限公司,288.28571428571433
北京山海银河国际旅行有限公司,86.85714285714285
华征(威海)生物科技有限公司,29.428571428571427
重庆长安智能工业技术服务有限公司,178.57142857142856
重庆亚狮文化传媒有限公司,16.142857142857142
上海非夕机器人科技有限公司,580.0577142857142
上海英之界教育科技有限公司,2859.5714285714284
小米科技有限责任公司,52861.42857142857
青岛泰凯英轮胎有限公司,5060.714285714285
广州博冠信息科技有限公司,376.1428571428571
武汉海微科技股份有限公司,628.4682571428569
重庆助友创美物业管理有限公司,291.0
中国华能集团有限公司,997150.1428571427
则正(上海)生物科技有限公司,1430.7142857142856
苏州腾迈医药科技有限公司,2858.714285714286
上海夺畅网络技术有限公司,22860.42857142857
河南双泽美丽家匠心装饰工程有限公司,58.57142857142856
贵州法智慧科技有限公司,29.285714285714285
欧姆龙电子部件贸易(上海)有限公司,104.42857142857142
西数服(西安)科技有限公司,29.285714285714285
中科航宇(北京)自动化工程技术有限公司,1013.7685714285714
佛山鸿远电子商务有限公司,288.7142857142857
北智财税顾问有限公司,1429.857142857143
贵黔国际医院管理有限公司,14289.142857142855
深圳市康冠科技股份有限公司,19579.465342857144
海尔集团电子商务有限公司,1076.5714285714284
长沙市大千装饰工程有限公司,11.285714285714285
京桔新能源汽车科技有限公司,11430.571428571428
贵州梦动科技有限公司,270.57142857142856
中国能源建设集团天津电力建设有限公司,30637.210685714283
友达光电(昆山)有限公司,44604.42857142857
沈阳万类生物科技有限公司,575.4285714285714
上海青翙科技有限公司,57.857142857142854
山东山大鸥玛软件股份有限公司,4388.36
台州市人月圆服饰有限公司,30.285714285714285
北京聚宽投资管理有限公司,287.8571428571429
内蒙古伊利实业集团股份有限公司南宁第一分公司,4.0
四川税当家科技有限公司,29.57142857142857
铭台(北京)科技有限公司,334.5116285714286
上海恒元界机器人科技有限公司,30.0
深圳市亮鑫装饰有限公司,59.28571428571428
富士通(南京)软件技术有限公司徐州分公司,3.0
广州磐世科技创新有限公司,57.857142857142854
重庆智飞生物制品股份有限公司,68577.85714285713
日立电梯(中国)有限公司,15400.891257142857
甘肃宝镁西铁合金有限公司,14288.428571428569
中船澄西扬州船舶有限公司,37226.32125714286
天津中航亿达科技有限公司,354.28571428571433
杭州娃哈哈未来文化艺术有限公司,574.0
北京能高普康测控技术有限公司,1430.4285714285713
石家庄润舟企业管理服务有限责任公司,287.28571428571433
广州远想生物科技股份有限公司,10288.571428571428
致同会计师事务所(特殊普通合伙)深圳分所,4.0
上海竞乐信息技术有限公司,294.71428571428567
中国通用技术(集团)控股有限责任公司,214291.71428571426
惠生(南通)重工有限公司,87679.59985714286
携程计算机技术(上海)有限公司,233.99999999999997
九阳股份有限公司,21920.2
正大投资股份有限公司,118826.94074285713
导术科技(杭州)有限公司,57.857142857142854
杭州玩点科技有限公司,29.57142857142857
广州市玄武无线科技股份有限公司,1506.942857142857
汉中市卓美医疗美容有限公司,87.71428571428571
天津津门有礼电子商务有限公司,87.57142857142856
上海耀乘健康科技有限公司,287.42857142857144
新疆光禾汇金商务信息服务有限责任公司,288.00000000000006
南京金斯瑞生物科技有限公司,2519.285714285714
中核高泰(宜宾)精密管材股份有限公司,4097.428571428571
中建八局第一建设有限公司,47568.148571428566
美林美邦(厦门)生物科技有限公司,716.4285714285713
华润建筑有限公司,34291.28571428572
中国出口信用保险公司山东分公司,5.428571428571429
中国工商银行股份有限公司大连市分行,7.7142857142857135
湖南嘉创信息科技发展有限公司,863.1428571428571
西安禧九网络科技有限公司,288.14285714285717
苏州盛世徽匠装饰工程有限公司,58.57142857142856
浙江赛思电子科技有限公司,6156.121628571427
上海有色网信息科技股份有限公司,342.69351428571434
华为终端有限公司,17318.285714285714
华视中广国际传媒(武汉)有限责任公司,2860.142857142857
深圳半岛医疗集团股份有限公司,10288.714285714284
北京沃丰时代数据科技有限公司,2860.428571428571
杉金光电(南京)有限公司,108574.28571428571
网新科技集团有限公司,2289.5714285714284
北京厨芯科技有限公司,1431.8571428571427
上海驰骛信息科技有限公司,498.38
深圳市未来工场科技有限公司,772.9433142857141
宁波中交水运设计研究有限公司,288.8571428571429
一汽弗迪新能源科技有限公司,28573.999999999996
青岛新城创置房地产有限公司,17159.142857142855
恒力重工集团有限公司,14288.285714285712
广州盈凯莱新材料有限公司,29.714285714285715
四川省第四建筑有限公司,5721.857142857143
上海睿伯思贸易有限公司,3.5714285714285707
成都潜在人工智能科技有限公司,104.57142857142856
广东衣起来环保科技有限公司,287.1428571428571
江苏苏南万科物业服务有限公司,307.0
上海即果信息技术有限公司,1430.8571428571427
青岛玖凌商务有限公司,289.14285714285717
合肥金星智控科技股份有限公司,1791.4285714285713
北京阿克姆热能科技开发有限公司,896.9999999999999
内蒙古双欣环保材料股份有限公司,24575.85714285714
中国移动通信集团江苏有限公司,80005.42857142858
纬景储能科技有限公司,5348.192114285714
蓝帆医疗股份有限公司,28779.665114285715
南京晶捷生物科技有限公司,1252.7142571428572
瑾萱电子(深圳)有限公司,29.857142857142858
陕西耀益百仕科技有限公司,1.2857142857142856
珍田家贸易(上海)有限公司,213.49905714285714
上海澜码科技有限公司,38.111314285714286
青岛迪生新星视觉科技有限公司,29.857142857142858
天台友景汽车用品有限公司,30.57142857142857
深圳古瑞瓦特新能源有限公司,12186.258657142856
中建八局华南投资发展有限公司,8573.857142857141
中交第四航务工程局有限公司,141884.7401142857
中国科学院沈阳自动化研究所,7.571428571428571
中电科航空电子有限公司,71289.57142857142
天津大沽化工股份有限公司,33077.14762857143
广州市福思特科技有限公司,33.0
绍兴融鼎利兴企业管理咨询有限公司,29.57142857142857
重庆一九四九演艺文化有限公司,59.285714285714285
周口正阳人工智能科技有限公司,3.5714285714285707
北京京城皮肤医院有限公司,147.71428571428572
世纪一束(杭州)医学诊断科技有限公司,1430.5714285714284
深圳市维海德技术股份有限公司,2978.7999999999997
优微(珠海)生物科技有限公司,63.13099999999999
江苏耀坤液压股份有限公司,2418.142857142857
长江存储科技有限责任公司,1848881.6257142858
广西盛隆冶金有限公司,85719.57142857142
英丽化学(上海)股份有限公司,946.142857142857
上海欣华阳国际货物运输代理有限公司,287.8571428571429
北京友友南洋科技有限公司,29.857142857142858
江苏银行股份有限公司常州分行,4.7142857142857135
乐金生活健康贸易(上海)有限公司,518.5714285714286
上海枂特环保科技有限公司,230.14285714285714
上海钢联物流股份有限公司,882.8398857142856
合肥旭阳铝颜料有限公司,1432.1428571428569
上海联空网络科技有限公司,351.6440857142857
上海为合信息科技有限公司,59.42857142857143
浙江大沩人工智能科技有限公司,287.14285714285717
上海念空数据科技中心(有限合伙),1430.9999999999998
绿州创造家(浙江)装饰股份有限公司,287.42857142857144
美的集团股份有限公司,200625.67874285716
招商银行股份有限公司佛山分行,5.0
中邮消费金融有限公司,85717.28571428571
江苏超万轴承科技有限公司,315.6485714285714
乐天创研(北京)科技有限公司,8574.0
深圳市锐科信息技术有限公司,1003.8571428571429
重庆博腾制药科技股份有限公司,15606.08057142857
秒针信息技术有限公司,575.7142857142858
北京腾信软创科技股份有限公司,1439.7357428571427
中石化中原石油工程有限公司,12861.142857142857
江苏乐灵智能科技有限公司,287.7142857142857
无锡奥特维科技股份有限公司,6429.7837714285715
苏州长征-欣凯制药有限公司,1105.336514285714
江苏希西维轴承有限公司,1148.1428571428573
南通友星线束有限公司,290.42857142857144
上海鹰角网络科技有限公司,289.0
北京宜信科创技术有限公司,860.2857142857142
西安趣联网络科技有限公司,30.14285714285714
厦门普诚科技有限公司,1003.5714285714286
上海中海物业管理有限公司,1434.9999999999998
南京圣和药业股份有限公司,12291.999999999998
深圳市理邦精密仪器股份有限公司,16627.052742857144
湖州全都来了网络科技有限公司,43.63525714285714
安徽旭翎网络科技有限公司,144.28571428571428
武汉捷鑫法律咨询有限公司,29.285714285714285
北京微蜜友网络科技有限公司,145.0
广东求学圆梦网络科技有限公司,287.2857142857143
上海胜勋人力资源有限公司,29.857142857142858
南京卡佩希网络科技有限公司,907.2857142857142
长沙威犀次元文化传播有限责任公司,29.285714285714285
深圳海外装饰工程有限公司,2293.714285714286
青岛海尔人力资源开发有限公司,21.71428571428571
上海格派镍钴材料股份有限公司,4879.2851142857135
上海金钕磁铁股份有限公司,146.85714285714286
特变电工新疆新能源股份有限公司,148673.14285714287
浙江盾安人工环境股份有限公司,30194.913771428568
秋炉(上海)科技有限公司,30.0
广东元心科技有限公司,288.14285714285717
福建大圣石业有限公司,287.42857142857144
中昊芯英(杭州)科技有限公司,298.40377142857136
广州智谷趋势数据服务有限公司,145.57142857142858
杭州掌玩网络技术有限公司,59.714285714285715
宁波绿桥供应链管理有限公司,144.42857142857144
山东中卓华图教育文化科技发展有限责任公司,573.2857142857143
上海电气集团股份有限公司,445142.54548571433
杭州众硅电子科技有限公司,2746.405342857143
安徽银禧科技有限公司,4287.714285714285
吴江华丰电子科技有限公司,6662.0
中粮贸易有限公司,51588.2356
华润怡宝饮料(中国)有限公司,18577.714285714283
上海上药信谊微生态科技有限公司,286.7142857142857
六安市皖达文化传媒有限公司,3.5714285714285707
北京馥蕾科技有限公司,928.2697999999999
泸州市鸿德名匠装饰设计工程有限责任公司,144.71428571428572
浙江风尚化妆品有限公司,859.7142857142857
北京我爱我家房地产经纪有限公司,351.9308571428571
中国建设银行股份有限公司大连市分行,7.571428571428571
中国平安财产保险股份有限公司广东分公司,6.285714285714286
中冶建工集团有限公司上海分公司,4.7142857142857135
上海复志信息科技股份有限公司,1017.0342857142856
四川小龙坎控股集团有限公司,944.3691714285713
宾堡(北京)食品有限公司,4752.857142857142
昌正医疗(苏州)有限公司,287.0
毕马威信息技术服务(南京)有限公司,661.5442857142857
精诚工科汽车零部件(张家港)有限公司,2858.2857142857138
宁波市水利水电规划设计研究院有限公司,1263.1999999999998
深圳冠晨网络有限公司,29.57142857142857
《中国激光》杂志社有限公司,31.857142857142854
广西南宁市吉士达弘房地产置业有限公司,29.57142857142857
厦门银泰海湾商业管理有限公司,1430.5714285714284
深圳青桐盛夏科技有限公司,145.0
西安西点信息技术有限公司,480.7142857142857
济南宏越电子有限公司,574.2857142857143
江苏然创新材料股份有限公司,2858.142857142857
东台晶澳太阳能科技有限公司,42859.71428571429
九一科创(重庆)科技有限公司,57.857142857142854
云南云美旅游产业开发有限公司,288.00000000000006
国光电器股份有限公司,13388.826085714285
重庆惠邦慧包科技有限公司,59.57142857142857
珠海阿巴马资产管理有限公司,788.2857142857142
江西珍视明药业有限公司,2861.428571428571
正雅齿科科技(上海)有限公司,343.0329714285714
明泰建设集团有限公司,1430.857142857143
兴业银行股份有限公司烟台分行,4.428571428571429
中国邮政储蓄银行股份有限公司福建省分行,4.571428571428571
华诺星空技术股份有限公司,2004.857142857143
铜陵有色金属集团铜冠矿山建设股份有限公司,4347.857142857142
精华制药集团股份有限公司,23268.883085714286
宁波灵均投资管理合伙企业(有限合伙),288.28571428571433
湖南万成云商科技有限公司,145.28571428571428
南京帝伯乐家政有限责任公司,87.14285714285714
昆明南网科技有限公司,289.00000000000006
华清未央(北京)科技有限公司,29.285714285714285
慧博云通科技股份有限公司,11433.285714285714
厦门市巨茂新能源有限公司,288.00000000000006
华益新桥(北京)科技发展有限公司,573.2857142857142
浙江明讯网络技术有限公司,6005.142857142858
东软集团南京有限公司,1147.0
天虹(中国)投资有限公司,2861.0
杭州德飞供应链管理有限公司,858.4285714285713
长沙湘一美容管理有限公司,4.285714285714285
中汽研华诚认证(天津)有限公司,575.8571428571429
海创智能装备(烟台)有限公司,2287.285714285714
龙泉工布数码科技有限公司,100.39845714285714
北京快手科技有限公司,2887.8599999999997
广州市研恒计算机科技有限公司,602.8571428571428
东易日盛家居装饰集团股份有限公司长沙分公司,5.142857142857142
广州域外科技有限公司,288.5714285714286
沈阳麟龙科技股份有限公司,10459.285714285714
维仕科技有限公司,5728.063085714285
中国石油天然气股份有限公司兰州石化分公司,5.7142857142857135
青岛凯诚众合人力资源有限公司,58.28571428571428
山重建机有限公司,21593.774285714288
泰山集团股份有限公司,2899.4724285714287
中国建筑西南勘察设计研究院有限公司,7187.285714285715
东风汽车集团有限公司,445721.2857142857
福建永荣控股集团有限公司,165718.14285714287
思安新能源股份有限公司,5718.285714285714
江苏宝众宝达药业股份有限公司,11584.285714285716
江苏农环能源科技有限公司,8082.999999999999
深圳瑞和建筑装饰股份有限公司上海分公司,6.7142857142857135
北京开放传神科技有限公司,78.88714285714285
银河互联网电视有限公司,5082.794285714284
太原韶天网络科技有限公司,9.285714285714285
大连智点优选网络科技有限公司,30.142857142857142
上海品职教育科技有限公司,287.8571428571429
中通服软件科技有限公司,718.7142857142857
杭州趣看科技有限公司,358.9838285714286
深圳凌波微步信息技术有限公司,286.85714285714283
广州长水生物科技有限公司,29.57142857142857
广西曲草堂医药物流有限公司,2288.4285714285716
丰巢网络技术有限公司,250717.2857142857
上海曲速超为技术有限公司,287.5714285714286
西安菡艺熙科技有限公司,57.99999999999999
山东合天智汇信息技术有限公司,149.99999999999997
福建空天碳智慧科技有限公司,859.1428571428571
深圳市绿联科技股份有限公司,10672.8516
卜蜂莲花企业管理有限公司,482.57142857142856
软通动力信息技术(集团)股份有限公司,27231.89077142857
东莞市振安教育投资有限公司,859.2857142857142
上海精陈科技有限公司,15.285714285714285
武汉吧哒科技股份有限公司,1205.857142857143
南京控维通信科技有限公司,575.9457142857142
中交一公局集团有限公司,218033.2749142857
青岛炽橙教育咨询有限公司,23.57142857142857
泰康人寿保险有限责任公司青岛分公司,5.428571428571429
湖南广播影视集团有限公司,85717.85714285713
鼎酬(上海)投资管理有限公司,16.57142857142857
TCL科技集团股份有限公司技术中心,5.7142857142857135
眉山市耀辉银升装饰有限公司,30.57142857142857
致保科技有限公司,1544.5643428571427
阿蒂法(上海)网络科技有限公司,31.71428571428571
深圳市瑞麒珠宝首饰有限公司,1140.7142857142858
芜湖长信科技股份有限公司,70145.37522857143
山西启佑房地产经纪有限公司,144.2857142857143
中国水利水电第十四工程局有限公司,70679.45577142856
北京洛可可科技有限公司,284.8908571428571
博彦科技承德有限公司,432.0
曼巴驱动技术(苏州)有限公司,308.505
北京富地时空信息技术有限公司,918.142857142857
无锡山姆超市有限公司,144.28571428571428
顾家家居股份有限公司,23487.471971428567
中粮集团有限公司,340577.54285714286
中国大冢制药有限公司,9008.42857142857
杭州亿达时科技发展有限公司,462.9428571428571
杭州华进联浙知识产权代理有限公司,30.999999999999996
炜呈智能电力科技(杭州)有限公司,654.6028571428571
中国航发哈尔滨东安发动机有限公司,44709.28571428572
青岛积成电子股份有限公司济南分公司,4.0
合肥国轩高科动力能源有限公司,285717.99999999994
北京蔚来汽车销售服务有限公司,7146.142857142857
久其数字传播有限公司,5599.101114285713
连云港贵科药业有限公司,1232.9590285714287
江苏鸿明企业管理咨询有限公司,287.42857142857144
西卡(中国)有限公司,1433.5714285714284
武汉上辰品牌形象设计有限公司,16.142857142857142
中国科技出版传媒股份有限公司,22591.571428571428
河南天海电器有限公司,16178.571428571428
北京首都在线科技股份有限公司,13342.223885714287
杭州一知智能科技有限公司,798.0504857142856
北京黄橙广告有限公司,147.14285714285714
山东铭途信息技术有限公司,87.42857142857143
成都旭星佳程广告有限公司,29.714285714285715
想出网络科技(上海)有限公司,145.57142857142858
