企业,评分
学信咨询服务有限公司,290.42857142857144
北京金科汇智科技有限公司,61.285714285714285
郑州恒辰电子科技有限公司,16.285714285714285
泰康人寿保险有限责任公司浙江嘉兴中心支公司,5.428571428571429
杭州蓝工建材有限公司,29.57142857142857
青岛万宝压缩机有限公司,2934.9428571428566
青岛齐鑫智能制造有限公司,57.71428571428571
华测检测认证集团股份有限公司,48086.09182857142
星箭科技股份有限公司,1665.0
昌荣传媒股份有限公司,11461.608571428571
北京达佳互联信息技术有限公司,171432.2857142857
新东方教育科技集团有限公司,1434.1428571428569
广州市建筑科学研究院集团有限公司,1717.7142857142856
武汉华之名品科技有限公司,59.57142857142857
爱齐(上海)商贸有限公司,718.5714285714286
昆仑天工科技有限公司,1431.4285714285713
杭州英联科技有限公司,289.1428571428571
杭州民生健康药业股份有限公司,10191.123714285714
中信证券股份有限公司海宁海昌南路证券营业部,5.428571428571429
浙江远翔医疗科技有限公司,286.85714285714283
平湖必益清洁设备有限公司,145.0
杭州冠寓投资管理有限公司,8573.0
福建联合石油化工有限公司,421661.85714285716
中盈优创资讯科技有限公司,2862.428571428571
埃特曼半导体技术有限公司,1457.5705714285716
中国移动通信集团甘肃有限公司,48650.84857142857
无锡赛思亿电气科技有限公司,2445.0
新数人(成都)科技有限公司,29.285714285714285
成都深信福瑞企业管理合伙企业(普通合伙),6.7142857142857135
成都飞象智汇企业管理有限责任公司,29.714285714285715
深信产教融合(成都)科技有限公司,64.49142857142857
河南音达通信科技有限公司,29.714285714285715
青岛大焱电子有限公司,288.00000000000006
北京积加科技有限公司,61.32011428571428
益普索(中国)咨询有限公司上海分公司,4.571428571428571
华为技术有限公司,1161182.7662857142
芝兰玉树(北京)科技股份有限公司,1563.2790285714284
百度在线网络技术(北京)有限公司,1296.5714285714284
成都职梦商务信息咨询有限公司,144.28571428571428
杭州研趣信息技术有限公司,905.3984857142856
蚂蚁云科技集团股份有限公司,2858.428571428571
北京小米移动软件有限公司,42518.28571428571
福州朴朴电子商务有限公司,1431.9999999999998
浙江金科日化新材料股份有限公司,2003.7142857142858
华润水泥投资有限公司,30484.29428571428
杭州聚合顺新材料股份有限公司,9018.914285714287
珍岛信息技术(上海)股份有限公司,793.0
北京科锐赛斯人力资源管理顾问有限公司,59.857142857142854
浙江摩方快仓科技有限公司,572.8571428571429
杭州恒致创新智能科技集团有限公司,155.89911428571426
宁波弗兰克定时电器有限公司,30.142857142857142
浙江海博数字技术服务有限公司,576.4285714285714
衢州市南竣装饰有限公司,14.999999999999998
杭州学业管理咨询有限公司,3.5714285714285707
雷允上药业集团有限公司,2783.72
青岛鼎信通讯消防安全有限公司,2860.285714285714
江苏省矿业工程集团有限公司,19366.67714285714
汤始建华建材(淮安)有限公司,2864.522857142857
枣庄爱尔眼科医院有限公司,716.2857142857142
无锡威孚高科技集团股份有限公司,28640.651228571427
南通帝人有限公司,114292.2857142857
安徽省有色金属新材料研究院有限公司,1430.9999999999998
广东海大集团股份有限公司,47540.85628571429
西安馥郁泽实业有限公司,800.9999999999999
广电计量检测集团股份有限公司,16440.452742857142
卓越际联科技有限公司,1431.4285714285713
北京仁科互动网络技术有限公司,8666.714285714286
众微致成(北京)信息服务有限公司,179.34145714285714
杭州来赞宝电子商务有限公司,170.36
杭州白贝壳实业股份有限公司,648.2764
广东南方财经全媒体集团股份有限公司,5082.5714285714275
上海柏旻服饰有限公司,31.428571428571427
上海得帆信息技术有限公司,726.4171714285714
宜宾市天珑通讯有限公司,2859.428571428571
广东迪士康新材料科技有限公司,144.14285714285714
宜昌凯丰资产管理有限公司武汉分公司,3.2857142857142856
武汉明合瑞海实业有限公司,1429.7142857142858
新疆梅花氨基酸有限责任公司,71432.71428571428
康龙化成(北京)新药技术股份有限公司,34040.13011428572
宁波住重机械有限公司,504.77508571428575
中美联泰大都会人寿保险有限公司上海分公司,3.4285714285714284
北京菁正咨询有限公司,145.0
焦作市和兴化学工业有限公司,290.0
芯联集成电路制造股份有限公司,200625.99999999997
北京掌上先机网络科技有限公司,284.2060857142857
广州凡岛网络科技有限公司,859.9999999999999
厦门市翰源资产管理有限公司安徽分公司,2.571428571428571
成都四方伟业软件股份有限公司,1086.9756857142856
蓝月亮(中国)有限公司,3432.7142857142853
西安比特教育科技有限公司,88.14285714285714
中软国际科技服务有限公司,2861.142857142857
牧原食品股份有限公司,150358.81697142855
联思智云(北京)科技有限公司,430.7142857142857
网易(杭州)网络有限公司,3936.2857142857138
上海有一有二网络技术有限公司,58.714285714285715
中国大地财产保险股份有限公司广东分公司,5.142857142857142
中天绿能科技有限公司,2859.142857142857
浙江中控信息产业股份有限公司,4291.571428571428
北京心力志成科技有限公司,288.7142857142857
宁波保税区展宏供应链有限公司,287.8571428571429
北京神州硕博信息技术有限公司,31.0
福建南孚市场营销有限公司,1718.142857142857
河北铁运铁路电气化技术有限公司,144.57142857142858
上海簇睿低碳能源技术有限公司,3207.285714285714
泰康人寿保险有限责任公司河北分公司,5.428571428571429
杭州思恩建筑科技有限公司,58.28571428571428
安徽闳瑞幸成信息技术有限公司,144.71428571428572
林肯电梯(中国)有限公司,5732.571428571428
格力电器(杭州)有限公司,22860.571428571428
无锡信捷电气股份有限公司,4020.5714285714284
杭州华润老桐君药业有限公司,852.4285714285713
宁波怡人玩具有限公司,291.14285714285717
友品国际化妆品(广州)有限公司,31.14285714285714
特斯拉汽车(北京)有限公司,60.0
成都国星宇航科技股份有限公司,1005.9918571428572
广东溢达纺织有限公司,8108.0
高途教育科技集团有限公司,1575.1428571428569
厦门加捷正大税务师事务所有限责任公司,12.142857142857142
杭州海康威视数字技术股份有限公司,266594.1694571429
上海紫衡文化传播有限公司,288.42857142857144
中核汇能有限公司,63205.77551428571
中国能源建设集团广东火电工程有限公司,31287.06
江苏地华实业集团有限公司,28576.85714285714
重庆悟空家承财税服务有限责任公司,1.4285714285714284
金华豁然晴朗艺术培训有限公司,30.142857142857142
京马电机有限公司,4290.999999999999
浙江锦智人工智能科技有限公司,286.7142857142857
航天智融信息技术(珠海)有限责任公司,302.75142857142856
深圳市小赢科技有限责任公司,28573.142857142855
深圳市奈百勒科技有限公司,434.9004285714285
小叶子(北京)科技有限公司,38.30045714285714
北京世纪好未来教育科技有限公司,5718.857142857143
泰盈科技集团股份有限公司,5704.400000000001
杭州赛思无际科技有限公司,32.43608571428571
湖南欧几里得教育科技有限公司,65.63428571428571
上海光玥生物科技有限公司,37.756885714285715
招商银行股份有限公司信用卡中心,4.857142857142857
杭州优迦科技有限公司,30.857142857142858
多益网络有限公司,1432.1428571428569
上海阿妙食品有限公司杭州分公司,3.571428571428571
中核汇能新疆能源开发有限公司,287.14285714285717
河北复典文保科技有限公司,858.5714285714286
上海壹佰米网络科技有限公司,228575.14285714284
双良集团有限公司,30006.428571428572
北京自如住房租赁有限公司,87440.9794
郑州海纳电子商务有限公司,89.42857142857143
大连金慧融智科技股份有限公司,2860.9999999999995
北京中公教育科技股份有限公司乌鲁木齐分公司,4.285714285714286
盐城新奥燃气发展有限公司,21.285714285714285
南通富泉工贸有限公司,575.0
上海月胧吟网络科技有限公司,345.65500000000003
安徽兴欣新材料有限公司,1717.7142857142856
青岛康都心理医院有限公司,574.0
河北铭恩建筑工程有限公司,287.5714285714286
南京一目智能科技有限公司,34.721085714285714
桂林壹极光信息科技发展有限公司,58.28571428571428
浙江大华技术股份有限公司,94133.25685714284
上海东浩人力资源有限公司,862.4285714285713
广州融创信息咨询有限公司,286.42857142857144
宁波银行股份有限公司温州分行,4.285714285714286
北京中电信联科技发展有限公司,1718.142857142857
广州华银康医疗集团股份有限公司,10288.142857142855
浙江无端科技股份有限公司,1594.0
杭州高节科技有限公司,15.285714285714285
圣奥集团有限公司,2862.285714285714
金华立致旅行社有限公司,15.285714285714285
浙江启胜国际货运代理有限公司,3432.285714285714
浙江加颜科技有限公司,287.0
成都市融兴汇付通科技信息服务有限公司,30.0
华道数据处理(苏州)有限公司沈阳分公司,2.714285714285714
中建八局第四建设有限公司,11461.651428571427
云南拓东味业食品有限公司,1444.5714285714287
常州市中淘家居用品有限公司,289.2857142857143
南京齐尔迈网络信息科技有限公司,146.0
安徽灿松工程技术有限公司,859.4285714285713
徐州时代兄弟影视文化传媒有限公司,2858.7142857142853
江苏船海工程设计研究院有限公司,858.9999999999999
成都远近信息技术有限公司,145.00000000000003
宏工科技股份有限公司,1718.8571428571427
成都聚海纳川科技有限公司,30.428571428571427
浙江超威动力能源有限公司,4290.0
博彦科技股份有限公司,16906.8168
深圳市即构科技有限公司,288.14285714285717
融创房地产集团有限公司,429005.28571428574
广东中策知识产权研究院有限公司,288.28571428571433
陇西千金药材有限公司,575.4285714285714
福建畅玩网络有限公司,2288.285714285714
深圳市汇合发展有限公司,367.1428571428571
珠海兴诺能源技术有限公司深圳分公司,3.0
嘉兴梅里家居有限公司,58.857142857142854
厚成人力资源集团有限公司,2002.857142857143
江苏苏州港集团有限公司,122061.77817142857
港华燃气投资有限公司,5720.0
盐城市友新建设工程有限公司,289.28571428571433
江苏恒誉环保科技有限公司,287.7142857142857
四川中融信通科技有限公司,58.99999999999999
华道数据处理(苏州)有限公司,5718.285714285714
国仪量子(合肥)技术有限公司,839.6399999999998
江苏金脚印服饰有限公司,287.14285714285717
上海电气上重铸锻有限公司,12860.714285714284
建锠(中国)精密不锈钢科技有限公司,1167.1818
中国电信股份有限公司新疆分公司,4.571428571428571
北京三高永信知识产权代理有限责任公司,18.57142857142857
辽宁博远教学科技有限公司,287.42857142857144
上海链家房地产经纪有限公司,1431.4285714285713
成都扶君凌云创享财税服务有限公司,15.142857142857142
成都兴元宁田信息技术咨询服务部,29.428571428571427
辽宁台安牧原农牧有限公司,5431.857142857143
上海洪启网络科技有限公司,30.999999999999996
贵州扁舟渡科技有限公司,2.142857142857143
西安华为技术有限公司,8575.999999999998
深圳市万万万更科技有限公司,29.285714285714285
扬州大阳日酸半导体气体有限公司,997.1428571428571
南通创亿达新材料股份有限公司,1593.2142857142856
天海融合防务装备技术股份有限公司,49377.83237142857
内蒙古伊利实业集团股份有限公司金山分公司,4.142857142857142
江苏帝伦国际贸易有限公司,288.7142857142857
大陆汽车电子(连云港)有限公司,698.7672571428571
北京银行股份有限公司南京分行,4.285714285714286
成都麓鹫科技有限公司,58.42857142857142
生益电子股份有限公司,23774.176428571423
北京顺腾网络科技有限公司,29.714285714285715
河南南流景文化传媒有限公司,29.285714285714285
南京依维柯汽车有限公司,72206.42857142857
北京易动行健体育场馆管理有限责任公司,60.14285714285714
中建一局集团建设发展有限公司,39492.02285714285
江苏普诺威电子股份有限公司,4003.9542857142856
北京千才汇信息技术有限公司,30.428571428571427
南京德云思信息科技有限公司,311.2857142857143
弘元绿色能源股份有限公司,11742.499399999999
广东省能源集团新疆有限公司,8573.857142857141
广东圣大电子有限公司,2860.285714285714
福州得游互娱科技有限公司,30.285714285714285
深圳依时货拉拉科技有限公司,2860.7142857142853
重庆小蛮腰电子商务有限公司,6.0
航天宏图信息技术股份有限公司,7467.225742857143
北京字跳网络技术有限公司,2860.2857142857138
中科星图股份有限公司,10445.957885714284
北京中名国成会计师事务所(特殊普通合伙)上海分所,2.714285714285714
上海蔚来汽车有限公司,85717.85714285713
江苏常熟农村商业银行股份有限公司盐城分行,3.714285714285714
开鑫科技有限公司,4009.7785714285715
珠海乐通新材料科技有限公司,1400.8742857142859
江西研兴国际教育科技有限公司,57.99999999999999
成都喵师兄网络技术有限公司,29.714285714285715
欣欣相融教育科技(北京)有限公司,2860.7142857142853
世纪金源投资集团有限公司,28576.999999999996
上海孚微网络科技有限公司,144.42857142857144
梅花生物科技集团股份有限公司,84104.31719999999
混沌时代(北京)教育科技有限公司,51.542857142857144
南京感动科技有限公司,347.39142857142855
上海宝尊电子商务有限公司,51433.857142857145
广州卖力跑商务服务有限公司,58.42857142857142
国育产教融合教育科技(海南)有限公司,572.5714285714286
广州高才信息科技有限公司,145.71428571428572
江苏易就业信息科技有限公司,287.00000000000006
常州雷哈那机械有限公司,25.857142857142854
华道数据股份有限公司,2946.9999999999995
江苏致想能源科技有限公司,573.4285714285714
中国银河证券股份有限公司扬州文昌中路证券营业部,4.7142857142857135
江苏ABB精科互感器有限公司,1432.0
常州康合营养家食品有限公司,30.999999999999996
上海斯米克建材有限公司南京分公司,5.857142857142857
奕瑞电真空技术(海宁)有限公司,459.1428571428571
江苏舜天股份有限公司,12546.942114285714
乐凯光电材料有限公司,2858.142857142857
南京三芯半导体设备制造有限公司,287.14285714285717
常州不二精机有限公司,204.28571428571428
昆山芯物联电子通讯有限公司,31.57142857142857
义乌市凯速贸易有限公司,30.285714285714285
北京三个逗号科技有限公司,1430.7142857142856
北京展心展力信息科技有限公司,288.5714285714286
软通动力信息技术(集团)股份有限公司,27231.89077142857
中微半导体设备(上海)股份有限公司,17612.127999999997
中国长城科技集团股份有限公司,92171.83105714286
上海媒趣智能科技有限公司,64.28571428571428
北京芬来花卉文化有限公司,31.285714285714285
世德集团有限公司,28576.85714285714
库卡机器人(广东)有限公司,2860.2857142857138
南京车事通信息科技有限公司,30.142857142857142
北京天时佳阁房地产投资顾问有限公司,31.857142857142854
苏州飞梦少儿艺术培训有限公司,30.285714285714285
苏州花无缺技术服务有限公司,144.85714285714286
龙之旅华人(北京)教育科技有限公司,1430.2857142857142
江苏紫金恒悦进出口有限公司,288.28571428571433
昆药集团股份有限公司,21670.879114285715
广东和祐医院管理有限公司,144.42857142857142
福建南方路面机械股份有限公司,3103.4761999999996
中复连众(连云港)风电叶片有限公司,1430.4285714285713
新奥集团股份有限公司,214291.8571428571
宝宝巴士股份有限公司,10290.142857142855
北京宏天信业信息技术股份有限公司,1500.4714285714283
深圳市云速易连科技有限公司,286.7142857142857
喜茶(深圳)企业管理有限责任公司,60861.0
宁波凯越集团有限公司,2858.142857142857
凯盛浩丰农业集团有限公司,2016.6085714285714
江苏森迪文旅集团有限公司,1429.5714285714284
芜湖品宅电子商务有限公司,88.57142857142856
江苏联环药业股份有限公司,8161.607714285715
苏州丰新光电有限公司,116.78991428571427
福建上丞建设集团有限公司,1719.5714285714284
华润万家有限公司,189824.06842857142
赫智科技(苏州)有限公司,1144.1428571428573
永诚财产保险股份有限公司江苏分公司,4.857142857142857
上海民用航空起落架系统有限公司,3144.714285714286
安徽皖通邮电股份有限公司,5719.857142857142
上海硕方医药科技有限公司,859.1428571428571
汤臣倍健股份有限公司,48596.90488571428
青建集团股份公司,34300.71428571428
无锡松煜科技有限公司,901.4956857142856
谱高医疗科技(南京)有限公司,260.4102857142857
北京高博中进信息技术有限公司,29.857142857142858
浪潮云信息技术股份公司,10350.664914285713
中源家居股份有限公司,2747.8571428571427
江苏华隆兴机械工程有限公司,863.1428571428571
莱福科技(扬州)有限公司,87.71428571428571
江苏三鑫特殊金属材料股份有限公司,1717.8571428571427
江苏有色金属进出口有限公司,7435.857142857142
长春凯达发展有限公司,37986.46714285714
南安市本真高级中学有限公司,29.428571428571427
江苏省农用激素工程技术研究中心有限公司,1004.7142857142857
常州常发制冷科技有限公司,6289.857142857143
南方泵业股份有限公司,10860.571428571428
苏州锐诚环保技术有限公司,29.857142857142858
中铁十五局集团城市轨道交通工程有限公司,28575.142857142855
常州市新北区新东方教育培训中心有限公司,58.857142857142854
上海翰迈电子科技有限公司,2859.285714285714
上海企莲商贸有限公司,4.7142857142857135
厦门市翰源资产管理有限公司,289.00000000000006
苏州智睿希尔智能科技有限公司,290.7142857142857
赣州啃佬鸭食品有限公司,288.28571428571433
江苏路劲物业服务有限公司,290.14285714285717
长沙咔咔互娱信息科技有限公司,30.0
沈阳创思佳业科技有限公司,147.14285714285717
微创投资控股有限公司,142860.99999999997
游酷盛世科技(北京)有限公司,355.9047428571429
苏州大禹数字文化科技集团有限公司,369.57005714285714
永信至诚科技集团股份有限公司,1984.5807999999997
南京鑫房汇房地产经纪有限公司,15.57142857142857
南京云鼎测控技术有限公司,287.7142857142857
江西荣欣针织有限公司,1430.1428571428569
上海非凸智能科技有限公司,287.7142857142857
上海汇鸿浆纸有限公司,4288.5714285714275
江苏捷士通射频系统有限公司,1860.857142857143
东部湾(扬州)生物新材料有限公司,910.2379428571428
青岛联信商务咨询有限公司郑州分公司,3.714285714285714
河北丰诺信息技术有限公司,573.7142857142857
青岛嘉芝宝服饰有限公司,29.714285714285715
蓝思科技股份有限公司,142104.28565714284
中联重科股份有限公司,247948.49245714283
融创华北发展集团有限公司,6417.98857142857
深圳市鹏天华晟信息科技有限公司武汉分公司,3.0
西安鑫盛汇源商贸有限公司,87.85714285714285
冠丰(上海)房地产发展有限公司镛舍酒店,3.4285714285714284
中交第三航务工程局有限公司宁波分公司,5.428571428571429
华芯巨数(杭州)微电子有限公司,773.2857142857142
广东肯富来泵业股份有限公司,1619.1053714285715
陕西国起文化传媒有限公司,144.28571428571428
卓越际联科技有限公司杭州分公司,2.4285714285714284
连连银通电子支付有限公司,9289.857142857141
北京集易行科技有限公司,1431.1428571428569
深圳市银雁科技有限公司,5148.5714285714275
青岛海信国际营销股份有限公司,861.7142857142858
联想(北京)有限公司,161435.42857142855
芜湖雄狮汽车科技有限公司,5716.857142857142
深圳市鹏腾信息技术有限公司,29.57142857142857
深圳市江波龙电子股份有限公司,11801.978685714284
徐州中嘉工程机械有限公司,59.57142857142856
艾德斯汽车电机无锡有限公司,625.8057142857143
上海紫燕食品股份有限公司,11777.142857142855
青岛镭测创芯科技有限公司,255.70914285714284
公证天业会计师事务所(特殊普通合伙)苏州分所,3.8571428571428568
南京三乐集团有限公司,8067.428571428571
郑州星原房地产经纪有限公司,30.142857142857142
安徽山河药用辅料股份有限公司,6703.865457142857
君乐宝乳业集团股份有限公司,20577.142857142855
恒申控股集团有限公司,142860.2857142857
浙江东鸿电子股份有限公司,574.2857142857142
赛勒罗亚车业(中国)有限公司,234.0
厦门国际银行股份有限公司厦门分行,4.571428571428571
江苏九天光电科技有限公司,1752.7
上海电气响水生物质发电有限公司,2618.4285714285716
南京罗朗微太电子科技有限公司,318.6031714285714
景茂针织(沭阳)有限公司,432.14285714285717
青岛世浦海事服务有限公司,175.14285714285714
苏州天准科技股份有限公司,5494.457142857143
江苏常居房地产营销策划有限公司,289.00000000000006
合肥联华智兴信息科技有限公司,11.285714285714285
元时空智能科技(重庆)有限公司,286.7142857142857
北京利安元家政服务有限公司,30.142857142857142
魔纷娱乐发展(上海)有限公司,2287.285714285714
东方优选(北京)科技有限公司,286.7142857142857
上海开域信息科技有限公司,18002.714285714286
清远万达广场商业管理有限公司,30.857142857142854
上海贝德玛化妆品贸易有限公司,214.9366
四川继圣开世教育科技有限公司,29.857142857142858
东莞市顺丰信息科技服务有限公司,287.8571428571429
浙江维克机械科技有限公司,288.28571428571433
山东富豪汽车销售集团有限公司,1716.0
苏州京东方医院有限公司,42860.28571428572
中国银河证券股份有限公司昆山萧林路证券营业部,3.2857142857142856
江苏韩通集团有限公司,859.5714285714286
领为视觉智能科技(宁波)有限公司,2976.8571428571427
江苏丰山集团股份有限公司,4646.333714285714
苏州新能先锋检测科技有限公司,1051.8624285714286
新韩银行(中国)有限公司盐城分行,3.4285714285714284
江苏石川岛丰东真空技术有限公司,859.7142857142857
杭州科匠信息科技有限公司,4.428571428571428
博西华家用电器服务江苏有限公司,290.2857142857143
南京创域数码科技股份公司,144.71428571428572
天津水泥工业设计研究院有限公司,9677.714285714284
佛山市名门盛世科技有限公司,30.285714285714285
北京掌趣科技股份有限公司,78789.83405714286
成都娄外科技有限公司,31.285714285714285
成都优卡信息科技有限公司,1431.7142857142856
物产中大云商有限公司,8574.0
小獐实业(上海)有限公司,31.71428571428571
邢台金沙河面业有限责任公司,1147.285714285714
福建扬腾创新信息科技有限公司,371.5004857142857
深圳市同行者科技有限公司,53.697657142857146
德州仪器半导体制造(成都)有限公司,3347.142857142857
江苏黄氏水产有限公司,288.00000000000006
上海必胜客有限公司,382.79999999999995
江苏卓远半导体有限公司,784.9389142857142
常州昱坤生物材料科技有限公司,287.0
中粮麦芽(江阴)有限公司,1004.1428571428571
江阴日毛纺纱有限公司,3672.5577714285714
中航光电科技股份有限公司,60578.18154285714
北京南方国际人力资源顾问有限公司,17.142857142857142
江苏通凯生态环境科技有限公司,290.2857142857143
玩咖欢聚文化传媒(北京)有限公司,2860.8571428571427
大连佰亚欧尚传媒有限公司,145.14285714285717
北京睿祥文乂技术服务有限公司,16.285714285714285
上海星海数智信息技术有限公司,29.285714285714285
优桥新媒体科技(北京)有限公司,144.14285714285717
泰豪软件股份有限公司,2802.684228571429
上海斐能营销策划有限公司,145.42857142857142
南京上秦淮酒店有限公司,574.0
江苏鸿基水源科技股份有限公司,1148.7142857142858
南京古田化工有限公司,162.42857142857142
常州剑湖金城车辆设备有限公司,576.1428571428571
苏州工业园区昊特物流设备有限公司,290.00000000000006
新浦化学(泰兴)有限公司,20060.714285714286
北京罗克维尔斯科技有限公司,28574.714285714283
北京神州之窗网络技术服务有限公司,32.14285714285714
山东宏桥新型材料有限公司,335987.5145428571
深圳市乐有家控股集团有限公司,14289.857142857141
北京猫眼文化传媒有限公司,289.2857142857143
天津清联网络孵化器有限公司,79.57142857142857
上海胜思广告有限公司,230.99999999999997
北京鸿联九五信息产业有限公司西安分公司,2.8571428571428568
益丰大药房连锁股份有限公司,28869.792628571427
郑州永速科技有限公司,15.428571428571427
