企业,评分
北京禹峰国际文化传媒有限公司,287.42857142857144
北京汇通天下物联科技有限公司,709.7860857142856
碧桂园生活服务集团股份有限公司,10290.857142857141
润楹物业服务(成都)有限公司,3433.8571428571427
上海新瑞谷科技集团有限公司,288.7142857142857
北京锐仕方达人力资源集团有限公司第三分公司,3.571428571428571
深圳市递四方速递有限公司,542.9579714285715
德瑞骅科技(北京)有限公司,30.285714285714285
杭州云吉文化创意有限公司,3.999999999999999
名创优品(广州)有限责任公司,4199.353485714286
创维液晶器件(深圳)有限公司,5719.285714285714
上海人赢网络科技有限公司,145.14285714285714
深圳迈瑞生物医疗电子股份有限公司,34647.039828571425
保利物业服务股份有限公司东莞分公司,4.142857142857142
广东浩传管理服务有限公司昆明高新分公司,2.571428571428571
赛先生(广州)科技有限责任公司,4.142857142857143
广州虹科电子科技有限公司,289.28571428571433
深圳汉莎技术有限公司,694.6302857142857
唐人神集团股份有限公司,40951.18265714286
广州德擎光学科技有限公司,162.14274285714285
北京优贝在线网络科技有限公司,290.2857142857143
杭州袋虎信息技术有限公司,52.86414285714285
青岛海尔智慧厨房电器有限公司,5570.8468571428575
哈尔滨瀚霖科技开发有限公司,1516.857142857143
成都鲲鹏共赢房地产经纪有限公司,3.5714285714285707
上海来伊份股份有限公司,9621.425942857142
上海海隆软件股份有限公司,9371.811428571425
上海海隆软件股份有限公司,163574.36179999998
泉州市鹰补教育咨询有限公司,29.57142857142857
君顶酒庄有限公司,7546.5714285714275
好多素教(浙江)网络科技有限公司,1430.2857142857142
深圳动态均衡健康科技有限公司,39.825314285714285
天津市中赢新材料科技有限公司,1432.857142857143
创新工场(北京)企业管理股份有限公司,1415.4820285714286
苏州核数聚信息科技有限公司,287.1428571428571
宜家(中国)投资有限公司,23992.314285714285
百智云(天津)科技有限公司,29.285714285714285
帝斯曼(中国)有限公司,1690.8
名之梦(上海)科技有限公司,572.4285714285714
远东国际租赁有限公司,51913.02634285714
北京蓝色极点医药科技发展有限公司,875.2857142857142
妮维雅(上海)有限公司,8133.760628571428
临沂市兰山区田字格艺术培训学校有限公司,6.57142857142857
恒力石化(惠州)有限公司,65071.42857142857
苏州荆棘鸟创业孵化管理有限公司,29.857142857142858
东阿阿胶股份有限公司,18405.909257142855
胜帮科技股份有限公司,4199.172914285714
无锡威孚精密机械制造有限责任公司,348.2857142857143
河南格入网络技术有限公司,30.14285714285714
河南时刻在线网络科技有限公司,32.0
上海腾桥信息技术有限公司,2859.285714285714
深圳市华孚进出口有限公司,42863.28571428571
上海塾宏商务咨询管理有限公司,29.714285714285715
重庆通威饲料有限公司,148.85714285714286
亨氏(中国)投资有限公司,2863.1879714285715
广州汇萨数据科技有限公司,29.428571428571427
北京算力大陆科技有限公司,286.85714285714283
万泓文化发展控股(辽宁)有限公司,88.14285714285714
上海妃鱼数字科技有限公司,360.9004857142857
腾讯音乐娱乐科技(深圳)有限公司,145.0
上海识致信息科技有限责任公司,288.85714285714283
安德阿镆贸易(上海)有限公司,3689.9999999999995
网易有道信息技术(北京)有限公司,3010.571428571428
网易(杭州)网络有限公司,3936.2857142857138
宁波格林兰生物质能源开发有限公司,859.5714285714286
杭州普洛赛斯检测科技有限公司,1032.2857142857142
厦门稻丁宠生物科技有限公司,29.57142857142857
北京大北农科技集团股份有限公司,118232.4815142857
喜丈(上海)网络科技有限公司,91431.71428571428
西藏金松电器科技有限公司,287.2857142857143
重庆传音通讯技术有限公司,288.85714285714283
深圳市卓驭科技有限公司,858.5714285714286
超讯通信股份有限公司南通分公司,3.4285714285714284
苏州恒创恩嘉电子科技有限公司,14.999999999999998
北京尚诚同力品牌管理股份有限公司,1146.9485714285713
西安仟信网络科技有限公司,29.428571428571427
安徽瑞斯康达科技有限责任公司,572.5714285714286
大连益乐教育咨询有限公司,10.142857142857142
西南证券股份有限公司,189866.8321142857
宁波明辰华羽互联网科技有限公司,29.428571428571427
北京途鸽海阔信息科技有限公司,3.0
百胜咨询(上海)有限公司,147.85714285714286
华鑫证券有限责任公司,102862.14285714286
影石创新科技股份有限公司,10288.714285714284
中国平安人寿保险股份有限公司,965719.7142857142
南京胜德金属装备有限公司,574.1428571428571
江苏金思维软件有限公司,888.8571428571428
正大水产(湖北)有限公司,1574.5714285714284
宁波和盛环境工程有限公司,287.8571428571429
甬矽电子(宁波)股份有限公司,11650.714285714284
杭州柯瓦新能源有限公司,291.99999999999994
广州黄埔君澜酒店有限公司,31.0
深圳市鼎焌电气有限公司,231.85714285714283
广州若众科技有限公司,289.0
东莞新能德科技有限公司,3147.285714285714
湊湊餐饮管理有限公司,2289.285714285714
锦翰网络科技(广州)有限公司,146.57142857142858
太古汇(广州)发展有限公司文华东方酒店,4.285714285714286
深圳市根巨科技有限公司,144.2857142857143
上海中智项目外包咨询服务有限公司,861.2857142857142
天津天材恒业建筑材料有限责任公司,4728.089999999999
海南好思达网络科技有限公司,622.2857142857142
云南辉云建筑装修设计有限公司,30.428571428571427
国信证券股份有限公司深圳分公司,3.8571428571428568
杭州览众数据科技有限公司,197.36791428571428
江苏引跑网络科技有限公司,1537.4483714285714
深圳卓凡教育管理有限公司,59.0
广东顺威精密塑料股份有限公司,20578.28571428571
任丘市华泰金属有限公司,603.7142857142857
复瑞渤商贸(上海)有限公司,1717.7142857142858
北京斯博特科技发展有限公司,30.428571428571427
紫藤知识产权运营(深圳)有限公司,440.2857142857143
北京墨迹风云科技股份有限公司,1146.5714285714287
添可智能科技有限公司,11431.714285714284
南京大数据安全技术有限公司,572.7142857142857
思必驰科技股份有限公司,10505.028314285712
绍兴柯桥畔雅纺织品有限公司,59.714285714285715
北京车智赢科技有限公司,145.85714285714286
深圳市领星网络科技有限公司,67.75519999999999
广州市悦程信息科技有限公司,291.0
上海安般信息科技有限公司,1066.6971428571428
北京小猿文化传播有限公司,58.71428571428571
宁波启点教育科技有限公司,146.0
南昌晨沛霈科技有限公司,29.285714285714285
北京查厘印象服装贸易有限公司,30.0
苏州贰捌信息科技有限公司,7.57142857142857
上海相宜本草化妆品股份有限公司,10291.428571428569
普洛斯投资(上海)有限公司,48576.57142857143
中建材信息技术股份有限公司,4272.428542857143
埃列特(上海)企业管理咨询有限公司,29.285714285714285
印月机电科技河北有限公司,288.14285714285717
康泰医学系统(秦皇岛)股份有限公司,11486.194285714284
永州市致尚克电子商务有限公司,29.285714285714285
保定帝能门窗制造有限公司,572.8571428571429
杏泰国际贸易(上海)有限公司,861.8571428571428
江阴市长江钢管有限公司,14291.999999999998
上海航鸿工程管理有限公司,1144.5714285714287
视听易(安徽)科技有限公司,287.7142857142857
东台市远洋船舶配件有限公司,936.8571428571428
南京科润工业介质股份有限公司,2884.571428571429
上海游族信息技术有限公司,5718.714285714285
上海壁仞科技股份有限公司,943.468
广西东呈酒店管理集团股份有限公司,10290.428571428569
广州市百果园信息技术有限公司,2003.5714285714284
深圳市美通供应链有限公司,88.57142857142856
广州弦歌堂生物科技有限公司,287.2857142857143
青岛冠中生态股份有限公司,4006.0
河南双碳生态研究院有限公司,143.85714285714286
无锡海市胜宴餐饮有限公司,30.14285714285714
南昌和风教育科技有限公司,1.714285714285714
西安张小熊医疗管理有限责任公司,87.14285714285714
上海如诺智析数据技术有限公司,29.285714285714285
施耐德电气(中国)有限公司,1277.8571428571427
杭州光云科技股份有限公司,12170.276685714285
磅客策(上海)智能医疗科技有限公司,1010.0203714285714
海马中际教育科技集团有限公司,1429.5714285714284
江苏中车环保设备有限公司,6437.5714285714275
浙江春风动力股份有限公司,4303.9760857142865
牵手未来科技(北京)有限公司,22858.714285714286
深圳市雷鸟网络科技有限公司,3478.1893999999998
上海晨光文具股份有限公司,26478.759142857143
威科寰球(武汉)电子商务有限公司,29.57142857142857
北京菁科创想信息技术有限公司,29.57142857142857
上海晨湃文化传媒有限公司,29.857142857142858
广州金科房地产开发有限公司,2888.717142857143
长远人力资源(北京)有限公司,29.57142857142857
兴业证券股份有限公司,246748.20839999997
河北冀旅铁路电气化技术有限公司,86.42857142857142
比亚迪股份有限公司,83181.9387142857
中国核工业二三建设有限公司,18393.691428571427
江苏帝奥微电子股份有限公司,7208.857142857142
北京万圣广告有限公司,1431.7142857142856
茂硕电源科技股份有限公司,10194.171971428572
厦门添亿互动文化传媒有限公司,144.28571428571428
广东客龙通用航空有限公司,287.00000000000006
广东虹勤通讯技术有限公司,2289.4285714285716
广州越秀康养产业投资控股有限公司,2858.7142857142853
安徽万汇徕餐饮管理有限公司,144.57142857142858
杭州汇谊文化传媒有限公司,3.5714285714285707
重庆鼎鸿医疗器械有限公司,4.285714285714285
重庆聚贤阁企业管理咨询有限公司,30.57142857142857
重庆三十七度健康管理有限公司,574.1428571428571
山东五征集团有限公司,2862.8571428571427
上海贵酒股份有限公司,9563.55517142857
中邮通建设咨询有限公司,3148.8571428571427
镇江苏宁置业有限公司苏宁广场购物分公司,3.8571428571428568
恒力期货有限公司,21434.285714285714
河北英科石化工程有限公司江苏分公司,3.2857142857142856
北京中电普华信息技术有限公司,36381.64
江苏华昌化工股份有限公司,27219.132742857142
成都智慧象教育科技有限公司,30.285714285714285
上海大智慧财捷信息科技有限公司,143.85714285714286
铂锐(上海)汽车科技有限公司,1145.142857142857
珠海市芯动力科技有限公司,313.2857142857143
上海凡心福位咨询管理有限公司,29.285714285714285
深圳市广和通无线股份有限公司,21886.022399999998
北京学术星球科技有限公司,29.57142857142857
南京巨鲨显示科技有限公司,289.7142857142857
太平人寿保险有限公司北京分公司海淀支公司,5.285714285714286
冠县谷小满食品有限公司,86.42857142857142
中科方寸知微(南京)科技有限公司,289.9626
上海安赛瑞实业有限公司,289.7142857142857
医渡云(北京)技术有限公司,1431.4285714285713
佛山市权泰电子有限公司,4.7142857142857135
上海朗拓美逊科技有限公司,144.28571428571428
华北铝业有限公司,13666.714285714284
安徽鹰峰电子科技有限公司,289.14285714285717
宁波景业建设有限公司,2885.285714285714
杭州龙悦有限公司,114287.85714285713
长沙万福富霁健康管理服务有限公司,29.428571428571427
盛景网联科技股份有限公司,11433.287657142857
湖南千弘科技有限公司,482.5714285714286
上海科之锐人才咨询有限公司,576.0
苏州市软件评测中心有限公司,861.5714285714284
厦门国际银行股份有限公司珠海分行,6.285714285714286
湖南宾莱商务咨询有限公司,58.57142857142856
杭州瑞江化工有限公司,1789.8571428571427
上海华测导航技术股份有限公司,15388.02477142857
苏州盛科通信股份有限公司,11718.714285714286
四川毅阁科技有限公司,58.28571428571428
南宁市邕江假日酒店有限责任公司,29.428571428571427
苏州维信电子有限公司,7685.428571428572
长春诗兰姆汽车零部件有限公司,89.14285714285714
内蒙古伊利实业集团股份有限公司液态奶事业部,5.7142857142857135
新瑞鹏宠物医疗集团有限公司,71432.42857142857
杭州蔚来汽车销售服务有限公司,1431.8571428571427
浙江富钢集团有限公司,4043.0
上海中宏翊琛网络科技有限公司,29.285714285714285
奥格科技股份有限公司,1896.681514285714
海南朝茑国际贸易有限公司,58.714285714285715
成都云银城物业管理有限公司,145.42857142857144
江苏金世缘乳胶制品股份有限公司,1113.5757142857142
山西搜才人力资源服务有限公司,144.14285714285717
南京善跑体育科技有限公司,2859.5714285714284
广州有鱼科技信息有限公司,103.32654285714284
中国平安人寿保险股份有限公司上海浦东城西路营销服务部,5.142857142857142
中国核工业二三建设有限公司台山项目部,4.428571428571429
中国核工业二三建设有限公司连云港项目部,5.142857142857142
广东信源物流设备有限公司,1435.7142857142856
宁波千瑞电子科技有限公司,31.14285714285714
宜宾琦丰绿色能源有限公司,2860.0
圣邦集团有限公司,5004.857142857142
和君集团有限公司,2860.142857142857
阿里巴巴(中国)软件有限公司,37.653771428571424
湖南倍荣信息咨询有限公司,57.857142857142854
深圳迅策科技有限公司,8574.285714285714
安徽南瑞中天电力电子有限公司,2862.142857142857
重庆重报电商物流有限公司,859.5714285714286
松茸新能源科技(深圳)有限公司,191.47617142857143
广州遇见小面餐饮股份有限公司,354.18559999999997
北京菁英天下国际教育咨询有限公司,145.42857142857142
小北互娱(北京)科技有限公司,29.57142857142857
深圳市世野科技有限公司,288.28571428571433
宿迁新亚科技有限公司,1766.5714285714284
江苏鸿恩医疗器械有限公司,573.2857142857143
博雅达勘测规划设计集团有限公司南京分公司,3.142857142857143
深圳明锐理想科技有限公司,1203.7142857142858
北京阿芬斯企业管理有限公司,22.57142857142857
奥默生物技术(上海)有限公司,145.42857142857142
安徽皓元药业有限公司,5716.428571428571
东莞市朗泰通科技股份有限公司,5967.726285714287
澜唯(上海)环境科技有限公司,5.857142857142857
广州小鹏汽车科技有限公司,175041.02254285713
上海中生奥罗拉生物技术有限公司,5716.857142857143
广东周大福珠宝金行有限公司,861.8571428571429
北京趋动科技有限公司,573.2857142857142
南京棕榈方达家政服务有限公司马鞍山分公司,2.571428571428571
广东领才企业管理有限公司,287.7142857142857
广州经传信息科技有限公司,859.8571428571428
成都风之谷网络科技有限公司,30.71428571428571
北京律华轨道交通技术研究院,289.2857142857142
牙博士医疗控股集团股份有限公司,1743.48
双胞胎(集团)股份有限公司,10005.285714285716
江苏永鼎股份有限公司,40394.6794
江阴利港发电股份有限公司,71976.57142857142
罗德公共关系顾问(北京)有限公司,24.86285714285714
郑州捷安高科股份有限公司,3198.2744857142857
江苏阿诗特能源科技有限公司,4289.0
杭州劲风教育科技有限公司,29.857142857142858
济南好前程信息咨询服务有限公司,4.142857142857142
浙江校友邦科技有限公司杭州分公司,3.4285714285714284
上海洗霸科技股份有限公司,4986.370657142857
创世蓝海品牌管理顾问(北京)有限公司,145.57142857142858
武汉中食创餐饮管理有限公司,144.2857142857143
舍弗勒投资(中国)有限公司,2862.2857142857138
深圳嘉悦美业有限公司,345.57142857142856
河北涵韵网络科技有限公司,87.42857142857142
四川清和科技有限公司,289.5714285714286
北京济康堂中医研究院,145.2857142857143
杭州翊鸣科技有限公司,29.428571428571427
南昌天儒方文化传播有限公司,29.57142857142857
伊之密股份有限公司,13392.888114285712
上海博量慧眼信息科技有限公司,132.5838857142857
杭州得明电子有限公司,146.2857142857143
江苏华进联源知识产权代理有限公司,287.14285714285717
河北万维建筑工程有限公司,1146.0
必驰互联(杭州)科技有限公司,29.714285714285715
抚州三和医药化工有限公司,860.8571428571428
浙江万楹恒辉螺纹科技有限公司,830.4285714285713
福耀集团长春有限公司,17148.571428571428
恩斯迈电子(深圳)有限公司,1485.7142857142856
超视界显示技术有限公司,600003.2857142857
中财招商投资集团有限公司,5611.0
江西青峰药业有限公司,7155.766114285714
深圳市伟博瑞吉软件有限公司,144.71428571428572
江苏先声药业有限公司,16257.857142857141
中国联合网络通信有限公司软件研究院,3.571428571428571
佛山市海天调味食品股份有限公司,158880.01554285715
青岛海信微联信号有限公司,2859.0
上海复森环境科技发展有限公司,58.42857142857142
北京假日阳光环球旅行社有限公司,575.1428571428571
上海万学教育信息咨询有限公司,31.999999999999996
云鲸智能(深圳)有限公司,30.857142857142858
宁波韵升股份有限公司,31788.51574285714
西安大秦互动娱乐有限公司,37.285714285714285
上海乐来汽车分析测试有限公司,64.42857142857143
北京戴卡互娱科技有限公司,32.42857142857143
北京响起来信息科技有限公司,859.2857142857142
上海小蛮牛云智电子商务有限公司,29.285714285714285
浙江中寅文旅集团有限公司,2859.0
浙江立泰复合材料股份有限公司,1123.455457142857
成都渤锐桥企业管理咨询有限公司,6.142857142857142
广东新宝电器股份有限公司,23488.73085714286
江西赣州兴万家现代农业发展有限公司,146.57142857142858
台积电(南京)有限公司,28574.85714285714
云路复合材料(上海)有限公司,110.94005714285714
上海臣邦医药科技股份有限公司,1513.0885714285714
上海京硅智能技术有限公司,608.7426571428571
无锡力捷丰科技有限公司,68.85714285714285
天津市医药集团有限公司,156947.71428571426
无锡中油瑞德防腐科技有限公司,859.7142857142857
上海吉茶餐饮管理有限公司,5717.571428571428
上海荷瑞展览有限公司,29.285714285714285
北京天福号食品有限公司,1525.1428571428569
上海万物新生环保科技集团有限公司,1432.8571428571427
南京诚创财务咨询有限公司,20.428571428571427
新疆秒速到家智能科技有限公司,144.14285714285714
爱奇创新科技(广州)有限公司,29.57142857142857
上海名津致远信息科技有限公司,30.142857142857142
北京林汐科技有限公司,144.28571428571428
内蒙古中伟达通讯有限责任公司,14.999999999999998
厦门日月谷温泉乡村俱乐部有限公司坤城汤岸分公司,3.714285714285714
陕西明德院法律信息咨询有限责任公司,29.57142857142857
彩数(上海)商务咨询有限公司,145.42857142857142
杭州友孚机电设备有限公司,312.0
海连(中国)国际货运有限公司广州分公司,4.857142857142857
厦门海悦山庄酒店有限公司,1147.7142857142858
中国贸促会专利商标事务所有限公司,83479.17345714287
鸿湖万联(江苏)科技发展有限公司武汉分公司,2.571428571428571
苏州旭光聚合物有限公司,1862.0
艾郎科技股份有限公司,11100.942857142856
北京创美信科技有限公司西安分公司,3.142857142857143
绍兴云羿装饰设计有限公司,81.14285714285714
广州秀美网络文化传媒有限公司,185.102
浙江齐治科技股份有限公司,1045.8857142857144
全成私募基金管理(海南)有限公司,286.7142857142857
义乌市追猫服饰有限公司,59.28571428571428
杭州谐云科技有限公司,835.2051714285714
广州市三川田文化科技股份有限公司,861.7142857142857
南京福康通健康产业有限公司,288.14285714285717
广州四三九九信息科技有限公司,2861.2857142857138
北京音娱时光科技有限公司,574.1428571428571
石家庄中基会计师事务所(普通合伙),88.28571428571428
软通动力技术服务有限公司杭州分公司,4.0
软通动力信息系统服务盐城有限公司,860.7142857142857
深圳尚米网络技术有限公司,288.0
厦门振为科技有限公司,373.7142857142857
威海市北征钓具有限公司,15.999999999999998
济宁硕乐商贸有限公司,6.428571428571428
无锡得闲互联网科技有限公司,29.285714285714285
汕头市乐享态中医药文化发展有限公司,15.857142857142856
上海志游网络科技有限公司,29.428571428571427
北京富胜家居用品有限公司,289.8571428571429
爱思开新材料(江苏)有限公司,1688.7142857142856
台州舍得健康管理有限公司,35.2046
圣晖系统集成集团股份有限公司,2862.428571428571
华仁供应链管理有限公司,1907.8571428571427
上海华诺宇创文化传媒有限公司,29.285714285714285
广州正惠电子科技有限公司,57.857142857142854
湖南嘉冠通信有限公司,287.7142857142857
四川九通信息科技有限公司,287.2857142857143
泰康人寿保险有限责任公司四川电话销售中心,4.142857142857142
杭州百业互联科技有限公司,30.285714285714285
湖南东方高级技工学校有限责任公司,87.71428571428571
苏州普联企业管理服务有限公司,59.714285714285715
深圳华云信息系统科技股份有限公司,2060.142857142857
上海软通动力实业有限公司,289.7142857142857
上海欣诺通信技术股份有限公司,1562.0
上海青瞳视觉科技有限公司,67.88431428571428
台州市椒江至高教育培训学校有限公司,15.285714285714285
东方瑞通(北京)咨询服务有限公司,289.42857142857144
浙江新通教育科技股份有限公司,2080.1972285714287
苏州博古特智造有限公司,549.7257142857142
南京朗驰集团有限公司,4933.557142857142
上海东大化学有限公司,2290.0
希望森兰科技股份有限公司,3948.8571428571427
山东潍坊润丰化工股份有限公司,7966.774114285714
江苏科耐信数码科技有限公司,315.14285714285717
浙江诸暨中天正和房地产资产评估有限公司,89.42857142857142
武汉市品晟法律咨询有限公司,29.285714285714285
锦州壹中体健身运动有限责任公司,3.999999999999999
广州瀚信通信科技股份有限公司,3497.228571428571
图灵深视(北京)科技有限公司,30.428571428571427
南阳艾络珍生物科技有限公司,14.999999999999998
选址星(江苏)信息科技有限公司,287.14285714285717
中交四航局第三工程有限公司,8584.961714285715
威海人生药业集团股份有限公司,2174.6330000000003
三星电子(中国)研发中心,62.28571428571428
云南沃盈商务信息咨询有限公司,144.57142857142858
南京坤略企业管理有限公司,30.714285714285715
山东电银建设工程有限公司,86.57142857142857
上海乐亲健康管理有限公司,287.25428571428563
广东联塑科技实业有限公司,82863.0
宁波兴业盛泰集团有限公司,20005.571428571428
扬州三快在线信息技术有限公司,860.5714285714286
子渡(天津)文化传媒有限公司,87.14285714285714
西安世筑名家装饰设计工程有限公司,144.2857142857143
安徽寰球法律咨询有限公司,144.14285714285717
文山艾维眼科医院有限公司,573.5714285714286
衡阳小淘科技有限公司,15.714285714285714
重庆懋光文化传播有限公司,34.714285714285715
上海蓝昊电气江苏有限公司,8575.0
江苏诚创智能装备有限公司,1461.2857142857142
圣象实业(江苏)有限公司,2575.5714285714284
江苏瀚海教育科技有限公司,573.8571428571429
启程教育咨询(陕西)有限责任公司,29.57142857142857
湖南越摩先进半导体有限公司,11716.0
滁州惠科光电科技有限公司,457146.14285714284
厦门市爱维达电子有限公司,3656.714285714286
杭州康吉森自动化工程技术有限公司,2858.714285714286
淮安慧全财务管理有限公司,30.0
宝马(中国)服务有限公司,164.14285714285714
上海云轴信息科技有限公司,217.85285714285715
埃森哲(中国)有限公司北京分公司,5.857142857142857
长沙君嘉企业服务有限公司,15.285714285714285
东港市玮豪传媒有限公司,14.999999999999998
义乌市辰青包装有限公司,30.142857142857142
江苏七欣天餐饮管理连锁有限公司,4089.4742857142855
北京三好同创装饰设计有限公司,346.14285714285717
深圳市绿康智能环保科技有限公司,30.0
遵义智佑达科技有限公司,10.571428571428571
烟台明德亨电子科技有限公司,1755.202857142857
广东永旺天河城商业有限公司,7068.028571428571
卓望信息技术(北京)有限公司,148.0
中芯国际集成电路制造(上海)有限公司,69719.99999999999
江苏亚电科技有限公司,2401.5980285714286
江苏创生源智能装备股份有限公司,1429.5714285714284
泰州美速汽车销售服务有限公司,232.0
广州御岫科技有限公司,58.28571428571428
贵州恩纶传媒有限公司,29.428571428571427
绿乘(厦门)文化传播有限公司,30.57142857142857
金华远思机电工业技术有限公司,18.428571428571427
扶沟牧原农牧有限公司,18860.85714285714
长沙壹鸽迪商贸有限公司,3.5714285714285707
